721,garde,Il garde secret son âge.,He keeps his age a secret.,Il _____ secret son âge.,Il <b>garde</b> secret son âge.,[sound:sapi5com-e66b0537-f2c0654b-70950b8c-96ae6fa8-f5061eb2.mp3]
722,télé,Il regarde parfois la télé.,He sometimes watches TV.,Il regarde parfois la _____.,Il regarde parfois la <b>télé</b>.,[sound:sapi5com-208d2647-f5cb336b-cd57531d-3de4e292-2a443916.mp3]
724,écouter,Vous devriez écouter son conseil.,You should listen to his advice.,Vous devriez _____ son conseil.,Vous devriez <b>écouter</b> son conseil.,[sound:sapi5com-04851d08-c8619ca5-8a0fed11-328ba47f-50864a65.mp3]
725,ouvrir,Veuillez ouvrir la fenêtre !,Please open the window.,Veuillez _____ la fenêtre!,Veuillez <b>ouvrir</b> la fenêtre!,[sound:sapi5com-1ace2ea1-15745ee5-ece3f8f6-5483209c-c7aa7a53.mp3]
726,droit,Va tout droit.,Go straight ahead.,Va tout _____.,Va tout <b>droit</b>.,[sound:sapi5com-ba36824c-65e84130-9234ae99-aa9280b2-9d26f494.mp3]
727,plusieurs,Elle m'a donné plusieurs livres.,She gave me several books.,Elle m'a donné _____ livres.,Elle m'a donné <b>plusieurs</b> livres.,[sound:sapi5com-b64f372d-c41d91b5-07626177-439c38fd-c6a28ce0.mp3]
728,type,Je me rappelle ce type.,I remember that guy.,Je me rappelle ce _____.,Je me rappelle ce <b>type</b>.,[sound:sapi5com-a20eadd0-6cfb82cd-d17bbd38-e0d095d5-5d3400cf.mp3]
728,type,"Quel est ton type, exactement ?",What is your type exactly?,"Quel est ton _____, exactement?","Quel est ton <b>type</b>, exactement?",[sound:sapi5com-707f75b3-1a56043d-5ebae8eb-0ebdab66-f6dabcfa.mp3]
731,œil,Garde un œil dessus.,Keep an eye on it.,Garde un _____ dessus.,Garde un <b>œil</b> dessus.,[sound:sapi5com-cd1e1068-5e51e74c-163ebec9-f6f9de6f-dc502f30.mp3]
732,plaisir,Au plaisir de vous revoir.,See you around.,Au _____ de vous revoir.,Au <b>plaisir</b> de vous revoir.,[sound:sapi5com-6e3a2698-b99de83c-5b022759-00a86209-a8999ff1.mp3]
732,plaisir,Je prends plaisir à travailler.,I enjoy working.,Je prends _____ à travailler.,Je prends <b>plaisir</b> à travailler.,[sound:sapi5com-9c228e37-7211da86-8cb0c61d-f01705bc-d3bf8689.mp3]
732,plaisir,Le plaisir est pour moi.,The pleasure is mine.,Le _____ est pour moi.,Le <b>plaisir</b> est pour moi.,[sound:sapi5com-b39c7e58-2ab44f38-2e30e7e4-dc9fa0f5-d680a4be.mp3]
733,capable,Je suis capable de parler.,I'm able to speak.,Je suis _____ de parler.,Je suis <b>capable</b> de parler.,[sound:sapi5com-ea37bbdd-5c200846-f71d6fd6-fe09beb0-0f67faae.mp3]
735,fin,Tout a une fin.,Everything has a purpose.,Tout a une _____.,Tout a une <b>fin</b>.,[sound:sapi5com-f2f643dd-25060492-d33302d2-a5bdd56d-a29f431d.mp3]
737,rire,Il fit rire les enfants.,He made the children laugh.,Il fit _____ les enfants.,Il fit <b>rire</b> les enfants.,[sound:sapi5com-6a1cd007-88aff038-9678afaf-68612981-eb862e55.mp3]
739,gagner,Je dois gagner ma vie.,I have to earn a living.,Je dois _____ ma vie.,Je dois <b>gagner</b> ma vie.,[sound:sapi5com-ed33f6da-8989f581-cede0f50-21acba62-bbee37e8.mp3]
739,gagner,Notre équipe peut gagner.,Our team can win.,Notre équipe peut _____.,Notre équipe peut <b>gagner</b>.,[sound:sapi5com-49339331-8a1c5799-fbc67910-3286509e-0d3ff819.mp3]
740,cuisine,La cuisine était propre.,The kitchen was clean.,La _____ était propre.,La <b>cuisine</b> était propre.,[sound:sapi5com-a3ec681b-0e3a49ec-535a1486-8cd62b4f-d4970596.mp3]
740,cuisine,Ma mère cuisine bien.,My mother cooks well.,Ma mère _____ bien.,Ma mère <b>cuisine</b> bien.,[sound:sapi5com-9a14905f-3becd066-914dc4d6-9a262418-e250d14d.mp3]
742,libre,Garde dimanche prochain de libre.,Keep next Sunday free.,Garde dimanche prochain de _____.,Garde dimanche prochain de <b>libre</b>.,[sound:sapi5com-79482ac1-b8464d48-4e000063-133c9d1f-1b3a9264.mp3]
742,libre,Je suis libre demain.,I am off duty tomorrow.,Je suis _____ demain.,Je suis <b>libre</b> demain.,[sound:sapi5com-102663d3-54a3b973-7ad03256-fa5abf36-83711f10.mp3]
747,telle,Laisse la pièce telle quelle.,Leave the room as it is.,Laisse la pièce _____ quelle.,Laisse la pièce <b>telle</b> quelle.,[sound:sapi5com-0118210f-f71ac815-f24c31a6-06d7774a-d6222f97.mp3]
748,voici,Voici mon numéro de compte.,Here's my account number.,_____ mon numéro de compte.,<b>Voici</b> mon numéro de compte.,[sound:sapi5com-ebdce447-746acb79-45609e7b-e71c2f41-662aff11.mp3]
748,voici,Voici ta chance.,This is your chance.,_____ ta chance.,<b>Voici</b> ta chance.,[sound:sapi5com-dd22d89f-607c1aa4-9ff4a803-b34846d7-f4e22144.mp3]
754,fleurs,Regarde toutes ces fleurs !,Look at all these flowers.,Regarde toutes ces _____!,Regarde toutes ces <b>fleurs</b>!,[sound:sapi5com-0a062358-9bb6a62e-24cf5997-87fdf7ad-c03887d7.mp3]
756,succès,Le plan était un succès.,The plan was a success.,Le plan était un _____.,Le plan était un <b>succès</b>.,[sound:sapi5com-97de0f66-2caaf228-41c0fd47-5274982e-ebfecdbf.mp3]
757,oublie,Ne nous oublie pas?!,Don't forget about us!,Ne nous _____ pas?!,Ne nous <b>oublie</b> pas?!,[sound:sapi5com-1a1c23cd-b9aac583-97a294b3-35a86034-ca475c3b.mp3]
759,mets,Mets une belle robe.,Put on a nice dress.,_____ une belle robe.,<b>Mets</b> une belle robe.,[sound:sapi5com-7309a561-f4122509-b607a863-a0192c95-9fd10def.mp3]
760,retour,Nous voulons toutes ton retour.,We all want you back.,Nous voulons toutes ton _____.,Nous voulons toutes ton <b>retour</b>.,[sound:sapi5com-d795f3ec-f75dda1d-709801ca-b7fdfed4-66ae219d.mp3]
761,gâteau,Prenez une part de gâteau.,Help yourself to a piece of cake.,Prenez une part de _____.,Prenez une part de <b>gâteau</b>.,[sound:sapi5com-d8618dba-498616a0-e0cfde9f-ddb171ae-8d527df0.mp3]
762,amour,Elle est mon premier amour.,She's my first love.,Elle est mon premier _____.,Elle est mon premier <b>amour</b>.,[sound:sapi5com-538464a8-1c969b00-e233eaa4-09f3f258-25ac03bc.mp3]
763,allée,Tu es allée trop loin.,You've gone too far.,Tu es _____ trop loin.,Tu es <b>allée</b> trop loin.,[sound:sapi5com-81cc45c3-5358ad45-7e05d485-e5b43d0b-70468bdd.mp3]
764,rapport,Je vais étudier ton rapport.,I'll study your report.,Je vais étudier ton _____.,Je vais étudier ton <b>rapport</b>.,[sound:sapi5com-e7a00db1-826456f6-fb5ad25f-c62c4251-28586cd8.mp3]
766,surprise,Ce fut une grande surprise.,That was a big surprise.,Ce fut une grande _____.,Ce fut une grande <b>surprise</b>.,[sound:sapi5com-5e1568ea-a26ac320-79c74cc8-b12b518d-28b9e14f.mp3]
766,surprise,Je me suis surprise.,I surprised myself.,Je me suis _____.,Je me suis <b>surprise</b>.,[sound:sapi5com-b44b8322-14fa0614-65b231d6-653c325c-e40be5e1.mp3]
767,noël,Noël arrive bientôt.,Christmas is soon.,_____ arrive bientôt.,<b>Noël</b> arrive bientôt.,[sound:sapi5com-973abd44-22fb4b30-54000439-b7cf49e4-debe3704.mp3]
768,tasse,Laquelle est ta tasse ?,Which cup is yours?,Laquelle est ta _____?,Laquelle est ta <b>tasse</b>?,[sound:sapi5com-778b221f-3467f608-2b06ec0f-7d13b488-3c678e42.mp3]
768,tasse,Tu as ma tasse.,You have my mug.,Tu as ma _____.,Tu as ma <b>tasse</b>.,[sound:sapi5com-817c69c6-c748d6e1-e04bedad-a44ab4e6-0ca0cd74.mp3]
769,étrange,"Ça semble étrange, pas vrai ?","It feels weird, doesn't it?","Ça semble _____, pas vrai?","Ça semble <b>étrange</b>, pas vrai?",[sound:sapi5com-a1ab3d92-292409a6-ca739540-5228121f-09fbe6ea.mp3]
769,étrange,Quel type étrange !,What a strange guy!,Quel type _____!,Quel type <b>étrange</b>!,[sound:sapi5com-42086fe6-36c9e799-36e1eaac-d8f3f277-addfbfe3.mp3]
770,bibliothèque,Je serai à la bibliothèque.,I'll be in the library.,Je serai à la _____.,Je serai à la <b>bibliothèque</b>.,[sound:sapi5com-5b3b0b16-1589c978-434a0e41-afa0d12f-f8da7dbb.mp3]
771,finir,Il va bientôt finir.,He'll be done soon.,Il va bientôt _____.,Il va bientôt <b>finir</b>.,[sound:sapi5com-49b7769a-93d24f3c-aaab808a-8b7af6be-b693f294.mp3]
771,finir,Nous devrions finir ceci.,We should finish this.,Nous devrions _____ ceci.,Nous devrions <b>finir</b> ceci.,[sound:sapi5com-f2ec9424-5a8154ef-c6de9b6a-fd0b4b84-1a7ede97.mp3]
772,gentil,Il est gentil.,He is kind.,Il est _____.,Il est <b>gentil</b>.,[sound:sapi5com-76b4dd34-9faab527-277d65ca-6b6d0086-71978d9f.mp3]
772,gentil,Votre père semble très gentil.,Your father seems very nice.,Votre père semble très _____.,Votre père semble très <b>gentil</b>.,[sound:sapi5com-78b20b02-cb787e85-a036dbc3-b5dec12f-b82a40e4.mp3]
773,dangereux,Conduire trop vite est dangereux.,Driving too fast is dangerous.,Conduire trop vite est _____.,Conduire trop vite est <b>dangereux</b>.,[sound:sapi5com-2741a2f3-2a1b76ec-a63136be-21d9ecf2-cf6a465b.mp3]
775,mit,Elle se mit à chanter.,She began to sing.,Elle se _____ à chanter.,Elle se <b>mit</b> à chanter.,[sound:sapi5com-d0fb4b77-fe7911ab-797cc5d1-33f1cbee-e36897e9.mp3]
776,adresse,Je connais son adresse.,I know her address.,Je connais son _____.,Je connais son <b>adresse</b>.,[sound:sapi5com-108062d6-4a9730bf-17d2f185-bf000c08-6b978d82.mp3]
777,cas,Ce cas est important.,This case is important.,Ce _____ est important.,Ce <b>cas</b> est important.,[sound:sapi5com-fa490bda-e910f135-715e15c5-9fce5f88-285a1c36.mp3]
778,jardin,Je travaille dur au jardin.,I work hard in the garden.,Je travaille dur au _____.,Je travaille dur au <b>jardin</b>.,[sound:sapi5com-7ba5518a-dda165e3-73c37285-6c3e3bc0-49853254.mp3]
780,bateau,Je vis sur un bateau.,I live on a boat.,Je vis sur un _____.,Je vis sur un <b>bateau</b>.,[sound:sapi5com-ce2fe1f8-06e6d02b-7f796552-09c0bf96-388fb61e.mp3]
781,venue,Tu es venue trop tard.,You came too late.,Tu es _____ trop tard.,Tu es <b>venue</b> trop tard.,[sound:sapi5com-6cb2f329-1e068c8c-39f0df3f-03b746c3-e6f7bd45.mp3]
782,payé,Cette décision a payé.,This decision paid off.,Cette décision a _____.,Cette décision a <b>payé</b>.,[sound:sapi5com-4e3e0827-b50ed870-98a3c0c1-65a67e6e-63a6e956.mp3]
785,repas,Ils ont terminé leur repas.,They finished their meal.,Ils ont terminé leur _____.,Ils ont terminé leur <b>repas</b>.,[sound:sapi5com-f111ea19-09cb18cd-36e29457-2d133b9e-967b2cca.mp3]
785,repas,Le repas est prêt.,Lunch is ready.,Le _____ est prêt.,Le <b>repas</b> est prêt.,[sound:sapi5com-2466771f-0144e7d8-1c741eeb-26b042aa-3d3038d6.mp3]
786,rivière,Allons nager à la rivière.,Let's go and swim in the river.,Allons nager à la _____.,Allons nager à la <b>rivière</b>.,[sound:sapi5com-a60d4c0f-663ca12b-6b7b7af4-e6d7040f-a22b54cf.mp3]
787,amoureux,Nous étions amoureux.,We were in love.,Nous étions _____.,Nous étions <b>amoureux</b>.,[sound:sapi5com-12c3feeb-55816564-acd23f12-e2001c3b-1fd50a9c.mp3]
788,réparer,Je vais le réparer maintenant.,I'll fix it now.,Je vais le _____ maintenant.,Je vais le <b>réparer</b> maintenant.,[sound:sapi5com-f85f0c7b-159eb738-cffec762-8c6c9a34-0ddee430.mp3]
788,réparer,Veuillez réparer ceci.,Please repair this.,Veuillez _____ ceci.,Veuillez <b>réparer</b> ceci.,[sound:sapi5com-aadf401d-36f84659-b9c5ff0b-f039f824-e7c8a3c6.mp3]
789,devoir,Faites votre devoir.,Do your duty.,Faites votre _____.,Faites votre <b>devoir</b>.,[sound:sapi5com-e21753bc-78ca8e66-9565f2a3-12f99faf-07bb5199.mp3]
789,devoir,Nous allons devoir travailler ensemble.,We're going to have to work together.,Nous allons _____ travailler ensemble.,Nous allons <b>devoir</b> travailler ensemble.,[sound:sapi5com-36bacd69-e3dac26e-f1a22f75-ea561190-383bcc18.mp3]
790,aie,Aie confiance en toi.,Have confidence in yourself.,_____ confiance en toi.,<b>Aie</b> confiance en toi.,[sound:sapi5com-61fa5278-bf0ae9ae-0347a668-838aef08-bdd1097f.mp3]
791,suite,Je rappelle tout de suite.,I'll call back soon.,Je rappelle tout de _____.,Je rappelle tout de <b>suite</b>.,[sound:sapi5com-649c305f-a3f270c6-93a0753f-d6487839-ebc9c331.mp3]
793,règles,Garde ces règles en tête.,Keep these rules in mind.,Garde ces _____ en tête.,Garde ces <b>règles</b> en tête.,[sound:sapi5com-0d0299ea-38a170d1-36b26539-5faf0159-ac72c96f.mp3]
794,appareil,Il a un appareil photo.,He has a camera.,Il a un _____ photo.,Il a un <b>appareil</b> photo.,[sound:sapi5com-e50f7685-ffa74e95-1d71a618-f6e66e41-54ea59f6.mp3]
794,appareil,Que fait cet appareil ?,What does this device do?,Que fait cet _____?,Que fait cet <b>appareil</b>?,[sound:sapi5com-cb72c97b-1176b89e-dd0ada02-6c98486d-e9b5eda1.mp3]
795,autour,Elle voyage autour du monde.,She is traveling around the world.,Elle voyage _____ du monde.,Elle voyage <b>autour</b> du monde.,[sound:sapi5com-546f9449-48e32e91-f14dfe83-507eca67-64f8ba3a.mp3]
796,quitter,Je veux quitter mon boulot.,I wanna quit my job.,Je veux _____ mon boulot.,Je veux <b>quitter</b> mon boulot.,[sound:sapi5com-c26bd33b-c8c50cbb-f4e79db4-0adb82f3-a02fcc38.mp3]
796,quitter,Veuillez quitter cette pièce.,Please leave this room.,Veuillez _____ cette pièce.,Veuillez <b>quitter</b> cette pièce.,[sound:sapi5com-131e66d4-6bb7bfa2-83f775e1-a52bb5b7-9c988dc1.mp3]
798,compris,Je ne compris pas.,I didn't understand.,Je ne _____ pas.,Je ne <b>compris</b> pas.,[sound:sapi5com-9aab9e54-70e2a3e5-91369179-69d1e004-68679386.mp3]
798,compris,"Vous avez compris, désormais ?",Have you got it yet?,"Vous avez _____, désormais?","Vous avez <b>compris</b>, désormais?",[sound:sapi5com-0e9893d6-5a0b5c75-611c7719-7075c689-29f1bf42.mp3]
800,piano,Il joue souvent du piano.,He often plays piano.,Il joue souvent du _____.,Il joue souvent du <b>piano</b>.,[sound:sapi5com-f4837a92-79159540-c998a5ac-42003185-4d43fcfa.mp3]
801,grosse,Nous faisons une grosse erreur.,We're making a big mistake.,Nous faisons une _____ erreur.,Nous faisons une <b>grosse</b> erreur.,[sound:sapi5com-20bf991f-e18e744e-de6ebacd-eb475038-4e9e9cb1.mp3]
803,oncle,Elle a rencontré son oncle.,She met her uncle.,Elle a rencontré son _____.,Elle a rencontré son <b>oncle</b>.,[sound:sapi5com-efc2e086-445e39a8-69ecbbb3-5b375fce-26de3f73.mp3]
804,projet,Comment va le projet ?,How's the project going?,Comment va le _____?,Comment va le <b>projet</b>?,[sound:sapi5com-d77bb517-d5b3cdc7-01c35f74-7f67b614-aebd428b.mp3]
805,travers,Tu as compris de travers.,You've misunderstood.,Tu as compris de _____.,Tu as compris de <b>travers</b>.,[sound:sapi5com-f6560e4c-6f96b8cd-ee81cf0a-78f34e3e-21ea1971.mp3]
807,poisson,Vous aimez le poisson?,Do you like fish?,Vous aimez le _____?,Vous aimez le <b>poisson</b>?,[sound:sapi5com-0f00d363-1d205611-7c537a0a-cb017e22-b1a147a1.mp3]
808,volé,On m'a volé mon sac.,My bag was stolen.,On m'a _____ mon sac.,On m'a <b>volé</b> mon sac.,[sound:sapi5com-82b0b91f-eafc85cd-5de253a1-a7e49b04-eee184dc.mp3]
809,poids,Elle prend du poids.,She is gaining weight.,Elle prend du _____.,Elle prend du <b>poids</b>.,[sound:sapi5com-e0e64166-5410c0a4-39fecd22-49ae7f7a-137709ff.mp3]
812,étudiant,Un étudiant fut arrêté.,One student was arrested.,Un _____ fut arrêté.,Un <b>étudiant</b> fut arrêté.,[sound:sapi5com-0408e866-b301ec50-d7177e0e-00fd9257-f9a36e83.mp3]
813,minute,Chaque minute compte.,Every minute counts.,Chaque _____ compte.,Chaque <b>minute</b> compte.,[sound:sapi5com-88e8b3f2-1d37ec0f-22453518-75ba3a95-877c6b45.mp3]
817,expliquer,Je vais expliquer les règles.,I'll explain the rules.,Je vais _____ les règles.,Je vais <b>expliquer</b> les règles.,[sound:sapi5com-18097b67-7229cf4d-534e5d47-7fbf7b07-2ce06731.mp3]
818,prudent,Soyez désormais plus prudent.,Be more careful from now on.,Soyez désormais plus _____.,Soyez désormais plus <b>prudent</b>.,[sound:sapi5com-26dc1779-268104cb-5af2cae8-0c834ad9-0fe3cc47.mp3]
820,liste,Faites une liste !,Make a list.,Faites une _____!,Faites une <b>liste</b>!,[sound:sapi5com-94afda04-89015bfb-875a7930-93785df5-088d30c3.mp3]
821,certains,Nous en sommes tous certains.,We're all sure of that.,Nous en sommes tous _____.,Nous en sommes tous <b>certains</b>.,[sound:sapi5com-4e2b397d-6494512d-ba331d5f-da961e2d-1e6f1fc8.mp3]
825,tenir,Je veux tenir ta main.,I want to hold your hand.,Je veux _____ ta main.,Je veux <b>tenir</b> ta main.,[sound:sapi5com-0b83e5fe-f530169b-c69982c2-ffa003fa-ce28bb57.mp3]
825,tenir,Veuillez le tenir secret.,Please keep this a secret.,Veuillez le _____ secret.,Veuillez le <b>tenir</b> secret.,[sound:sapi5com-5ad9722d-16db4b4d-15c50ca3-43a1b118-ea4c5124.mp3]
829,tour,Veuillez attendre votre tour.,"Wait for your turn, please.",Veuillez attendre votre _____.,Veuillez attendre votre <b>tour</b>.,[sound:sapi5com-3baa1401-9fca55ba-7b5256f8-56ca519e-8a469037.mp3]
831,hors,Reste hors de ma vue !,Keep out of sight.,Reste _____ de ma vue!,Reste <b>hors</b> de ma vue!,[sound:sapi5com-66902e8b-0713e83c-ea024d0c-c1c36dc4-2963cb52.mp3]
833,marche,Ça ne marche pas?!,That won't work!,Ça ne _____ pas?!,Ça ne <b>marche</b> pas?!,[sound:sapi5com-29e7bb80-f7ded18c-76fe6b56-90d09e1a-e2418378.mp3]
833,marche,Marche le plus vite possible.,Walk as fast as possible.,_____ le plus vite possible.,<b>Marche</b> le plus vite possible.,[sound:sapi5com-6c3d0447-f639d8fe-496dd35d-f82b0a7e-489dcff3.mp3]
835,lever,Vous devriez vous lever tôt.,You should get up early.,Vous devriez vous _____ tôt.,Vous devriez vous <b>lever</b> tôt.,[sound:sapi5com-a5ba9c1d-4258feb0-042a402c-4fd921f4-77f8f982.mp3]
836,ouvert,Le magasin est ouvert.,The store is open.,Le magasin est _____.,Le magasin est <b>ouvert</b>.,[sound:sapi5com-de5e09b4-3467b53b-a69d1247-31bb80eb-165549bb.mp3]
841,court,Ce chien court très vite.,That dog runs very fast.,Ce chien _____ très vite.,Ce chien <b>court</b> très vite.,[sound:sapi5com-4284da2d-e6ded39a-97b93eb2-d7f0962a-20c26faa.mp3]
841,court,La police me court après.,The police are after me.,La police me _____ après.,La police me <b>court</b> après.,[sound:sapi5com-a263a50c-e7523b8b-03a3b67e-da7a8d27-a537524b.mp3]
842,sommeil,Il nous faut du sommeil.,We need sleep.,Il nous faut du _____.,Il nous faut du <b>sommeil</b>.,[sound:sapi5com-0ff840e0-b8ba9492-232d01b9-2ca822bf-97791edb.mp3]
842,sommeil,Je commence à avoir sommeil.,I'm getting sleepy.,Je commence à avoir _____.,Je commence à avoir <b>sommeil</b>.,[sound:sapi5com-2b477793-1c77cce4-2e08a4e2-6efb5241-7051b4c9.mp3]
844,danger,Nous sommes hors de danger.,We are free from danger.,Nous sommes hors de _____.,Nous sommes hors de <b>danger</b>.,[sound:sapi5com-9be43179-33626198-a3c1b561-586b358d-1de599d6.mp3]
846,tableau,Le tableau est presque terminé.,The painting is all but finished.,Le _____ est presque terminé.,Le <b>tableau</b> est presque terminé.,[sound:sapi5com-d8b6d1dc-65af42ff-60d489e4-e589e6e6-e31f061b.mp3]
846,tableau,Quel beau tableau !,What a beautiful scene!,Quel beau _____!,Quel beau <b>tableau</b>!,[sound:sapi5com-39dddfd9-3fbe042f-16583650-bd9ecafd-bfb3257b.mp3]
846,tableau,Regarde ce tableau.,Look at that picture.,Regarde ce _____.,Regarde ce <b>tableau</b>.,[sound:sapi5com-5ab54b5b-2705e4ad-95b4a4b9-7b93b278-cad7b579.mp3]
847,bu,Il a bu une bière.,He drank a beer.,Il a _____ une bière.,Il a <b>bu</b> une bière.,[sound:sapi5com-22564b78-6cfaf496-344ef9ef-03d3a3ff-d8bd1918.mp3]
848,mari,Il sera un bon mari.,He will be a good husband.,Il sera un bon _____.,Il sera un bon <b>mari</b>.,[sound:sapi5com-3b17ecf8-368ccef5-639a2db9-22d71b8d-17f77e2e.mp3]
849,noir,Tout est devenu noir.,Everything went black.,Tout est devenu _____.,Tout est devenu <b>noir</b>.,[sound:sapi5com-c44ce2b0-96be4f49-58207117-9c9fa7db-88eaf56a.mp3]
851,prison,Ils furent mis en prison.,They were put in prison.,Ils furent mis en _____.,Ils furent mis en <b>prison</b>.,[sound:sapi5com-027608aa-77d63f50-cb7b3914-8dab83bd-b9a0236c.mp3]
853,voyager,Il aime voyager par avion.,He likes air travel.,Il aime _____ par avion.,Il aime <b>voyager</b> par avion.,[sound:sapi5com-549faf83-18b60faa-bc52df68-18647d1a-a9a68cac.mp3]
854,rappeler,Je vais devoir te rappeler.,I'll have to call you back.,Je vais devoir te _____.,Je vais devoir te <b>rappeler</b>.,[sound:sapi5com-1a8b5eef-8e330d78-46317f4e-2173e8a6-44b81ba0.mp3]
860,pleuvoir,Il pourrait pleuvoir vers midi.,It may rain around noon.,Il pourrait _____ vers midi.,Il pourrait <b>pleuvoir</b> vers midi.,[sound:sapi5com-db4e2a64-48555264-e105f302-4c964cca-7755b163.mp3]
862,connaître,Elle pourrait connaître la réponse.,She might know the answer.,Elle pourrait _____ la réponse.,Elle pourrait <b>connaître</b> la réponse.,[sound:sapi5com-67936552-6a09cd8d-4ea2a613-fa32b0a8-06d2a47a.mp3]
863,simple,Ça rend tout plus simple.,That makes everything simpler.,Ça rend tout plus _____.,Ça rend tout plus <b>simple</b>.,[sound:sapi5com-c980500f-15481711-dfedc3e6-49ff9431-74c78add.mp3]
863,simple,La réponse est plutôt simple.,The answer is pretty simple.,La réponse est plutôt _____.,La réponse est plutôt <b>simple</b>.,[sound:sapi5com-ec61e73e-8e978a7b-1a2159d8-065081db-9dc8dd19.mp3]
864,face,Il a perdu la face.,He lost face.,Il a perdu la _____.,Il a perdu la <b>face</b>.,[sound:sapi5com-7ec2764d-778c2fbd-3e7dc25d-47654f39-d37af263.mp3]
867,fou,Elle me rend fou.,She drives me crazy.,Elle me rend _____.,Elle me rend <b>fou</b>.,[sound:sapi5com-dc3b0843-30c03846-5fd640b4-1e594772-2303371f.mp3]
867,fou,Il est devenu fou.,He has gone mad.,Il est devenu _____.,Il est devenu <b>fou</b>.,[sound:sapi5com-0b54b74b-413c895e-a5892f47-c737c778-5a7240bf.mp3]
867,fou,Tu es fou.,You're demented.,Tu es _____.,Tu es <b>fou</b>.,[sound:sapi5com-9fa76317-6059d11a-a6c88c57-943a2dda-15ca7c23.mp3]
871,lunettes,Mets tes lunettes !,Put your glasses on.,Mets tes _____!,Mets tes <b>lunettes</b>!,[sound:sapi5com-ad0dac7c-d2eb4a84-867b0493-4c788398-659ad573.mp3]
872,papier,Je veux du papier.,I want some paper.,Je veux du _____.,Je veux du <b>papier</b>.,[sound:sapi5com-ed414203-37fa06bf-65efac4e-93583010-64fc41a5.mp3]
873,sérieux,"Sois sérieux, je te prie !",Please be serious.,"Sois _____, je te prie!","Sois <b>sérieux</b>, je te prie!",[sound:sapi5com-8d79c4e6-04737918-b460b91a-cebddf20-3974f98b.mp3]
876,conseillé,Il m'a conseillé ce dictionnaire.,He recommended this dictionary to me.,Il m'a _____ ce dictionnaire.,Il m'a <b>conseillé</b> ce dictionnaire.,[sound:sapi5com-7a74b868-debb3296-97a0c626-e4c86f50-1f21d9c9.mp3]
879,cassé,Tu t'es cassé le bras.,You broke your arm.,Tu t'es _____ le bras.,Tu t'es <b>cassé</b> le bras.,[sound:sapi5com-7fd3877a-553913d5-6e130a90-563331d8-4b6a11d7.mp3]
880,expérience,Ce fut une bonne expérience.,That was a good experience.,Ce fut une bonne _____.,Ce fut une bonne <b>expérience</b>.,[sound:sapi5com-c5e7587b-891359a9-c8799760-cfa089a9-b9b7a07d.mp3]
881,invité,Il m'a invité chez lui.,He invited me to his house.,Il m'a _____ chez lui.,Il m'a <b>invité</b> chez lui.,[sound:sapi5com-538733f8-b7ca2293-7c0e3210-01a8f7f9-39d09591.mp3]
882,pire,Ça aurait pu être pire.,It could've been worse.,Ça aurait pu être _____.,Ça aurait pu être <b>pire</b>.,[sound:sapi5com-bdedeb85-f57b5c29-df26be91-16cb4571-2fa930a1.mp3]
888,courir,Je voulais juste aller courir.,I just wanted to go jogging.,Je voulais juste aller _____.,Je voulais juste aller <b>courir</b>.,[sound:sapi5com-ffc83c56-1d78fd40-116f7817-3c84947f-142cae10.mp3]
888,courir,Venez courir avec moi.,Come run with me.,Venez _____ avec moi.,Venez <b>courir</b> avec moi.,[sound:sapi5com-a8bed850-cd4da7cd-65414721-0bf2846b-016e24ad.mp3]
891,faute,Ça pourrait être une faute.,This could be a mistake.,Ça pourrait être une _____.,Ça pourrait être une <b>faute</b>.,[sound:sapi5com-7a6887f9-1498a524-c4272c28-2edab843-0a509e6e.mp3]
892,radio,La radio ne fonctionne pas.,The radio doesn't work.,La _____ ne fonctionne pas.,La <b>radio</b> ne fonctionne pas.,[sound:sapi5com-729cac77-c3a07639-4b9f44e2-80b9bc8b-c322e766.mp3]
893,opinion,Je veux connaître ton opinion.,I want to know your opinion.,Je veux connaître ton _____.,Je veux connaître ton <b>opinion</b>.,[sound:sapi5com-41295cc8-b41f71b2-87171fb4-87f18eb8-205bcc51.mp3]
894,danser,Elle l'a regardé danser.,She watched him dance.,Elle l'a regardé _____.,Elle l'a regardé <b>danser</b>.,[sound:sapi5com-3ba3a0a1-b58f3550-58f77e2b-e4862f55-8e704a34.mp3]
894,danser,Je suis fatiguée de danser.,I'm tired of dancing.,Je suis fatiguée de _____.,Je suis fatiguée de <b>danser</b>.,[sound:sapi5com-c947266b-4498dfaa-e78065b8-9c1d518d-53aced8e.mp3]
896,fermer,Vous auriez dû la fermer.,You should have kept your mouth shut.,Vous auriez dû la _____.,Vous auriez dû la <b>fermer</b>.,[sound:sapi5com-6e863f8c-185c1d73-0ea8296e-0ab2aaad-e6247cf0.mp3]
897,asseoir,Veuillez vous asseoir une minute.,Please sit down for a minute.,Veuillez vous _____ une minute.,Veuillez vous <b>asseoir</b> une minute.,[sound:sapi5com-462d7314-d7fb9e57-6477b4c3-93c462b7-9db12070.mp3]
898,regardez,Regardez où vous allez !,Watch where you're going!,_____ où vous allez!,<b>Regardez</b> où vous allez!,[sound:sapi5com-13aacde5-ecf1d20c-af5c3b72-fce16165-e4818a93.mp3]
898,regardez,Regardez tous le tableau noir.,"Look at the blackboard, everyone.",_____ tous le tableau noir.,<b>Regardez</b> tous le tableau noir.,[sound:sapi5com-fe3f02c7-8435f33c-9827417b-d7cfd051-c9e4f664.mp3]
899,présenter,Vous devriez présenter vos excuses.,You should apologize.,Vous devriez _____ vos excuses.,Vous devriez <b>présenter</b> vos excuses.,[sound:sapi5com-47ee1966-224cfa94-f9721f2a-99ad45b3-43bb389e.mp3]
900,mariage,Notre mariage a pris fin.,Our marriage is over.,Notre _____ a pris fin.,Notre <b>mariage</b> a pris fin.,[sound:sapi5com-f6db7457-af3379bb-704a83ac-455c8b1d-a757af28.mp3]
901,manque,Il manque de confiance.,He lacks confidence.,Il _____ de confiance.,Il <b>manque</b> de confiance.,[sound:sapi5com-173f924c-0fc25055-4c10e816-f450a055-58fdad49.mp3]
901,manque,Une boîte manque toujours.,One box is still missing.,Une boîte _____ toujours.,Une boîte <b>manque</b> toujours.,[sound:sapi5com-5e0a9e47-2f3bc42f-68cc3db0-ab42f0e1-e9c94681.mp3]
902,satisfait,Il sera vraiment satisfait.,He will be really pleased.,Il sera vraiment _____.,Il sera vraiment <b>satisfait</b>.,[sound:sapi5com-4ea288b9-d49db7e2-d7d4d631-53abb513-ea114df6.mp3]
