286,non,"Non, tu ne peux pas.","No, you can't.","_____, tu ne peux pas.","<b>Non</b>, tu ne peux pas.",[sound:sapi5com-e7696b2a-35649632-671efbcd-98109fb8-f0a84211.mp3]
286,non,"Vous voulez cela, non ?","You do want that, don't you?","Vous voulez cela, _____?","Vous voulez cela, <b>non</b>?",[sound:sapi5com-4edd59bb-800364df-a0e691e3-176eeffb-93c755e0.mp3]
287,ville,Il est nouveau en ville.,He's new in town.,Il est nouveau en _____.,Il est nouveau en <b>ville</b>.,[sound:sapi5com-3a4b344c-96155c54-d2d15853-c9dd973c-89770c5b.mp3]
287,ville,Je suis de la ville.,I'm from the city.,Je suis de la _____.,Je suis de la <b>ville</b>.,[sound:sapi5com-d4e11839-e72577b2-b017f357-760cac7c-2bf42188.mp3]
287,ville,Je vais en ville.,I'm going downtown.,Je vais en _____.,Je vais en <b>ville</b>.,[sound:sapi5com-a6e5ef67-5504bf22-7408c8be-d5d62633-df82d242.mp3]
288,jouer,"Je veux jouer, moi aussi.","I want to play, too.","Je veux _____, moi aussi.","Je veux <b>jouer</b>, moi aussi.",[sound:sapi5com-ccfdd82a-14fecc16-1d55592c-826fcaa9-9395ae7a.mp3]
289,frère,Où est votre autre frère ?,Where's your other brother?,Où est votre autre _____?,Où est votre autre <b>frère</b>?,[sound:sapi5com-e2d8cae5-bf6ca021-d7d1d8bc-a921367b-e97de6b5.mp3]
289,frère,Va aider ton frère !,Go and help your brother.,Va aider ton _____!,Va aider ton <b>frère</b>!,[sound:sapi5com-fb95ec2f-2c10e7e5-d00e8bbb-b73e8358-29ded9b0.mp3]
290,lit,À qui est ce lit ?,Whose bed is that?,À qui est ce _____?,À qui est ce <b>lit</b>?,[sound:sapi5com-62de2a65-a2b73aef-5433c5d8-986dc5bb-33de9e81.mp3]
290,lit,Elle ne lit jamais.,She never reads.,Elle ne _____ jamais.,Elle ne <b>lit</b> jamais.,[sound:sapi5com-f49874ff-6d329135-881188f8-5fb759f6-a25e31a9.mp3]
290,lit,Je vais au lit.,I am going to bed.,Je vais au _____.,Je vais au <b>lit</b>.,[sound:sapi5com-295c53e1-7c1f5b14-35c7b3dc-ec7b5345-e73ce3ff.mp3]
290,lit,La femme lit.,The woman is reading.,La femme _____.,La femme <b>lit</b>.,[sound:sapi5com-4a7b8dbc-d07692ec-db7ea6a1-9d178a77-4611f30f.mp3]
290,lit,Tu devrais rester au lit.,You should stay in bed.,Tu devrais rester au _____.,Tu devrais rester au <b>lit</b>.,[sound:sapi5com-a04b9382-5bdececd-308d76db-11c982fe-8d0d5baf.mp3]
296,aucun,Aucun ne me parle.,Nobody speaks to me.,_____ ne me parle.,<b>Aucun</b> ne me parle.,[sound:sapi5com-66399d51-1d102979-66abdc2b-d5108154-3dce07b2.mp3]
296,aucun,Je ne veux aucun d'eux.,I don't want either of them.,Je ne veux _____ d'eux.,Je ne veux <b>aucun</b> d'eux.,[sound:sapi5com-69843a34-f1c91091-316f100e-59a1dc58-630b2890.mp3]
297,tard,À plus tard !,Catch you later.,À plus _____!,À plus <b>tard</b>!,[sound:sapi5com-df1a46c3-b3122a28-1ee75792-6fb9f1f4-f1df566b.mp3]
297,tard,Il est déjà tard.,It's already late.,Il est déjà _____.,Il est déjà <b>tard</b>.,[sound:sapi5com-b87569ab-e64b663c-af2b5705-32628fe7-36c06c08.mp3]
297,tard,Je suis arrivé trop tard.,I arrived too late.,Je suis arrivé trop _____.,Je suis arrivé trop <b>tard</b>.,[sound:sapi5com-dd5ef310-92382fa7-5256b65a-853e61fe-d2b128f1.mp3]
300,nouvelle,Il veut une nouvelle voiture.,He wants a new car.,Il veut une _____ voiture.,Il veut une <b>nouvelle</b> voiture.,[sound:sapi5com-126298ad-2a204866-a7f0b91b-9ad58c80-b9f60ffc.mp3]
300,nouvelle,Nous avons une bonne nouvelle.,We have good news.,Nous avons une bonne _____.,Nous avons une bonne <b>nouvelle</b>.,[sound:sapi5com-1e0b13c6-db45f558-3e40848f-63b25bbf-37c56c18.mp3]
302,enfant,Même un enfant sait cela.,Even a child knows that.,Même un _____ sait cela.,Même un <b>enfant</b> sait cela.,[sound:sapi5com-580d73f8-dfa8a160-f92ae28b-bafa35d8-ada528ea.mp3]
304,désolé,Désolé pour ça.,Sorry about that.,_____ pour ça.,<b>Désolé</b> pour ça.,[sound:sapi5com-139a5c23-680d5631-4ef2d67e-483ae2c2-9ecc0fb0.mp3]
304,désolé,"Désolé, je dois partir.","Sorry, I've got to go.","_____, je dois partir.","<b>Désolé</b>, je dois partir.",[sound:sapi5com-0c8206c2-0489485a-74a6de01-22ca892c-d22b0abf.mp3]
304,désolé,Ne soyez pas désolé !,Don't be sorry.,Ne soyez pas _____!,Ne soyez pas <b>désolé</b>!,[sound:sapi5com-df630950-7852c2bd-acde7f15-f4a74e81-f4db5ff5.mp3]
306,sujet,Je connais bien ce sujet.,I am familiar with this subject.,Je connais bien ce _____.,Je connais bien ce <b>sujet</b>.,[sound:sapi5com-72c3d139-93be2930-2b0bd396-0e17b4cd-51e1776b.mp3]
307,davantage,Ça a davantage de sens.,That makes more sense.,Ça a _____ de sens.,Ça a <b>davantage</b> de sens.,[sound:sapi5com-83af5169-d348fe1f-84c425cb-6bb1891a-a2583f94.mp3]
307,davantage,Il en veut davantage.,He wants more.,Il en veut _____.,Il en veut <b>davantage</b>.,[sound:sapi5com-430b798a-e09280d4-587c6d9d-97758e98-57a30adf.mp3]
307,davantage,Je voudrais faire davantage.,I'd like to do more.,Je voudrais faire _____.,Je voudrais faire <b>davantage</b>.,[sound:sapi5com-d1ec416d-934c4450-a66ffa35-8916d16b-eaf1c3fe.mp3]
307,davantage,Tu devrais en savoir davantage.,You should know better than that.,Tu devrais en savoir _____.,Tu devrais en savoir <b>davantage</b>.,[sound:sapi5com-8f1eed58-2f4fc34b-d2abebdf-acac4261-098d693b.mp3]
308,entre,Entre dans la pièce.,Come into the room.,_____ dans la pièce.,<b>Entre</b> dans la pièce.,[sound:sapi5com-a5084b98-e9afe247-315a250f-2d2399d3-62d07a67.mp3]
309,presque,Elles en sont presque là.,They're almost here.,Elles en sont _____ là.,Elles en sont <b>presque</b> là.,[sound:sapi5com-047c600b-bd20d6cd-65bde987-a72735bf-24741ac0.mp3]
309,presque,Il est presque trois heures.,It's nearly three o'clock.,Il est _____ trois heures.,Il est <b>presque</b> trois heures.,[sound:sapi5com-704aa18f-b4aeeaf7-f92f3fb3-66b0ef8f-7fbadfc3.mp3]
309,presque,Je te crois presque.,I almost believe you.,Je te crois _____.,Je te crois <b>presque</b>.,[sound:sapi5com-7ead46a4-12b9d33c-e409d92c-50535595-11ede876.mp3]
309,presque,Nous y sommes presque.,We're almost there.,Nous y sommes _____.,Nous y sommes <b>presque</b>.,[sound:sapi5com-0c3ed365-7ac2edd7-6314274d-690c92b3-820b6104.mp3]
309,presque,Tu as presque raison.,You're about right.,Tu as _____ raison.,Tu as <b>presque</b> raison.,[sound:sapi5com-5b5a2120-b16aaedf-1a11593a-d035bf33-e8fd9d5a.mp3]
310,travailler,Elle a dû travailler beaucoup.,She must have worked very hard.,Elle a dû _____ beaucoup.,Elle a dû <b>travailler</b> beaucoup.,[sound:sapi5com-936dcc68-21354d47-4320c98e-cc96a66b-827282b3.mp3]
310,travailler,"Je dois travailler, demain.",I have to work tomorrow.,"Je dois _____, demain.","Je dois <b>travailler</b>, demain.",[sound:sapi5com-1491bc75-0400822c-79518ce4-9bf91070-e86b6912.mp3]
310,travailler,Je vais travailler.,I'll work.,Je vais _____.,Je vais <b>travailler</b>.,[sound:sapi5com-06b69e68-4f88f8dc-21611fd4-a671ad1b-a9228b04.mp3]
310,travailler,Nous pouvons y travailler.,We can work on it.,Nous pouvons y _____.,Nous pouvons y <b>travailler</b>.,[sound:sapi5com-4ba9a034-a5e0fc57-582aa4e3-b2e84e37-26dcb02c.mp3]
310,travailler,Personne ne veut travailler.,Nobody wants to work.,Personne ne veut _____.,Personne ne veut <b>travailler</b>.,[sound:sapi5com-3537abc7-0be5f523-6d524957-5489db2c-58ad7936.mp3]
312,vrai,Ça peut bien être vrai.,It may well be true.,Ça peut bien être _____.,Ça peut bien être <b>vrai</b>.,[sound:sapi5com-63fc2d24-f150105b-b69dad7a-c414cca6-2062e551.mp3]
312,vrai,Tout cela est vrai.,That's all true.,Tout cela est _____.,Tout cela est <b>vrai</b>.,[sound:sapi5com-1f6549b4-39d0cacf-21f0f3cb-937c4c54-a00b726b.mp3]
312,vrai,"Tu as peur, pas vrai ?","You're afraid, aren't you?","Tu as peur, pas _____?","Tu as peur, pas <b>vrai</b>?",[sound:sapi5com-32a32039-530aa030-9d07dc32-7be4e300-5ed34d01.mp3]
313,chaque,Je viens ici chaque jour.,I come here every day.,Je viens ici _____ jour.,Je viens ici <b>chaque</b> jour.,[sound:sapi5com-16017fc7-8741338e-3afb0ccd-6a5a1d1d-c75247af.mp3]
314,vérité,Dites toujours la vérité.,Always tell the truth.,Dites toujours la _____.,Dites toujours la <b>vérité</b>.,[sound:sapi5com-84d77eb1-00a29215-8fe60200-4d2e979c-05438e18.mp3]
314,vérité,"En vérité, tu as raison.","Actually, you're right.","En _____, tu as raison.","En <b>vérité</b>, tu as raison.",[sound:sapi5com-19e2a0ea-909dfa6a-63bb0879-ed738782-46a40d73.mp3]
315,passe,Je passe avant toi.,I outrank you.,Je _____ avant toi.,Je <b>passe</b> avant toi.,[sound:sapi5com-eace36b8-c243d014-b41f6095-26747df3-4c3eb1c5.mp3]
315,passe,Je passe du bon temps.,I am living the good life.,Je _____ du bon temps.,Je <b>passe</b> du bon temps.,[sound:sapi5com-d4dd74d6-4113920c-7520577e-f06f6215-7034336a.mp3]
315,passe,Passe du bon temps !,Have a nice time.,_____ du bon temps!,<b>Passe</b> du bon temps!,[sound:sapi5com-f4690d3a-f207c8d9-b1431573-df953619-d2280dcc.mp3]
315,passe,Passe quand tu veux.,Come whenever you want.,_____ quand tu veux.,<b>Passe</b> quand tu veux.,[sound:sapi5com-1b7cb7eb-a5ac0949-f4973a4c-58c8dd6e-1dbe284b.mp3]
315,passe,"Quelque chose se passe, ici.",Something is going on here.,"Quelque chose se _____, ici.","Quelque chose se <b>passe</b>, ici.",[sound:sapi5com-345e664c-f4314a22-d9eefb1f-3c9b23d1-bac53eef.mp3]
318,moins,Je suis moins heureux maintenant.,I'm not as happy now.,Je suis _____ heureux maintenant.,Je suis <b>moins</b> heureux maintenant.,[sound:sapi5com-a7947373-18ebc643-ed21268b-b2bb25ab-c783ac3d.mp3]
320,sœur,Comment va ta sœur ?,How is your sister?,Comment va ta _____?,Comment va ta <b>sœur</b>?,[sound:sapi5com-d8eaaefb-5a1ba35f-d7e74016-8750acf3-2b9b4649.mp3]
320,sœur,Ma sœur a un travail.,My sister has a job.,Ma _____ a un travail.,Ma <b>sœur</b> a un travail.,[sound:sapi5com-f6a536e3-e3d31a15-dd2b1a98-8e7d44b7-1cdfbf2b.mp3]
320,sœur,Nous sommes frère et sœur.,We are brother and sister.,Nous sommes frère et _____.,Nous sommes frère et <b>sœur</b>.,[sound:sapi5com-58e823cb-b0b0f736-ac4991cf-0a4970e9-f56a1fa3.mp3]
320,sœur,Où est votre sœur ?,Where's your sister?,Où est votre _____?,Où est votre <b>sœur</b>?,[sound:sapi5com-45115e3e-71ec37de-a8d4a35f-f760b4fc-49327ddc.mp3]
321,lettre,Cette lettre est pour toi.,This letter is for you.,Cette _____ est pour toi.,Cette <b>lettre</b> est pour toi.,[sound:sapi5com-2f3a3c9d-7ae13262-92bafee6-7d5564ff-1f179b1c.mp3]
322,mort,Je voudrais être mort.,I wish I was dead.,Je voudrais être _____.,Je voudrais être <b>mort</b>.,[sound:sapi5com-7d28f635-0dd8dc6f-13f2d871-bfca9a31-b72a4700.mp3]
322,mort,Le chien est comme mort.,The dog is as good as dead.,Le chien est comme _____.,Le chien est comme <b>mort</b>.,[sound:sapi5com-13c8edfe-9b672cdd-1e653f8e-f7006c37-bc3c0a2e.mp3]
322,mort,Tout le monde est mort.,Everyone's dead.,Tout le monde est _____.,Tout le monde est <b>mort</b>.,[sound:sapi5com-d13aeb2f-bf15e24e-6f5ca674-b338d8de-24bf6a7e.mp3]
323,jeune,Je me sens jeune.,I feel young.,Je me sens _____.,Je me sens <b>jeune</b>.,[sound:sapi5com-b08a6372-bddf9c71-abe7a9c2-a229b1ff-036e01a9.mp3]
323,jeune,Je pensais être trop jeune.,I thought I was too young.,Je pensais être trop _____.,Je pensais être trop <b>jeune</b>.,[sound:sapi5com-417e891d-5dcbf33b-3072a0b1-25485a95-841122e6.mp3]
323,jeune,Sa sœur semble jeune.,His sister looks young.,Sa sœur semble _____.,Sa sœur semble <b>jeune</b>.,[sound:sapi5com-f870982b-7f98f62f-0440b02f-8bc6d4d6-943e3edb.mp3]
323,jeune,Tu es encore jeune.,You're still green.,Tu es encore _____.,Tu es encore <b>jeune</b>.,[sound:sapi5com-735d657c-9c81525f-3e2e9264-7df8e2a3-859ebbd2.mp3]
323,jeune,Tu es jeune et fort.,You're young and strong.,Tu es _____ et fort.,Tu es <b>jeune</b> et fort.,[sound:sapi5com-4ad7b90d-755436e9-b851b27d-134c2d47-fa253a03.mp3]
325,bureau,Elle est sur mon bureau.,It's on my desk.,Elle est sur mon _____.,Elle est sur mon <b>bureau</b>.,[sound:sapi5com-bc78c7fd-9d876752-a2f8c419-1cbc3d09-bbbea790.mp3]
325,bureau,Il est à son bureau.,He is at his office.,Il est à son _____.,Il est à son <b>bureau</b>.,[sound:sapi5com-e9068410-daf626c7-dc7acf0d-8049aee0-ae82942d.mp3]
325,bureau,Il est au bureau.,He is at the office.,Il est au _____.,Il est au <b>bureau</b>.,[sound:sapi5com-714cb8eb-29afb369-9999dc3a-b96cb3cd-5da1618f.mp3]
325,bureau,Où va ce bureau ?,Where does this desk go?,Où va ce _____?,Où va ce <b>bureau</b>?,[sound:sapi5com-620eaa2e-913e9fb3-6b6aaa6b-c081c1a9-58c4ccc9.mp3]
325,bureau,Viens à mon bureau.,Come to my office.,Viens à mon _____.,Viens à mon <b>bureau</b>.,[sound:sapi5com-ba720265-6448d291-bbf128f8-716433bd-6dd76e7b.mp3]
330,journée,Bonne journée à toi !,Enjoy your day.,Bonne _____ à toi!,Bonne <b>journée</b> à toi!,[sound:sapi5com-79494c0f-25a23c24-c18c1b2c-7edcacb5-81043569.mp3]
330,journée,Passe une bonne journée.,Have a nice day.,Passe une bonne _____.,Passe une bonne <b>journée</b>.,[sound:sapi5com-bea3fd05-96c422eb-5144286f-f409aced-2a51dd09.mp3]
332,sortir,Elle veut sortir avec lui.,She wants to go out with him.,Elle veut _____ avec lui.,Elle veut <b>sortir</b> avec lui.,[sound:sapi5com-d9553c7a-e9b7f9c3-769c34a0-4321ec7b-27f78b80.mp3]
332,sortir,Je devrais sortir.,I should head out.,Je devrais _____.,Je devrais <b>sortir</b>.,[sound:sapi5com-d869e5b9-af890776-95c0e645-df9f3514-8c2fada3.mp3]
332,sortir,Je veux sortir ce soir.,I want to go out tonight.,Je veux _____ ce soir.,Je veux <b>sortir</b> ce soir.,[sound:sapi5com-95ebf139-c1c444e8-cc9ea6c5-792f2143-f2f15f0f.mp3]
332,sortir,Vous ne pouvez pas sortir.,You can't go out.,Vous ne pouvez pas _____.,Vous ne pouvez pas <b>sortir</b>.,[sound:sapi5com-5cbc1b6a-fa114fe5-fd3e981c-93d09b65-0525ab82.mp3]
333,téléphone,À qui est ce téléphone ?,Whose phone is that?,À qui est ce _____?,À qui est ce <b>téléphone</b>?,[sound:sapi5com-61d1dbcc-c74304e4-526cd025-c071059d-edc37cad.mp3]
333,téléphone,Il lui téléphone chaque soir.,He calls her up every night.,Il lui _____ chaque soir.,Il lui <b>téléphone</b> chaque soir.,[sound:sapi5com-a3403245-56cf00e1-86d89627-acf59346-faa1fe97.mp3]
333,téléphone,On vous demande au téléphone.,You're wanted on the telephone.,On vous demande au _____.,On vous demande au <b>téléphone</b>.,[sound:sapi5com-d09296bc-d5d15190-a016ba0e-250479ee-9c2d3581.mp3]
333,téléphone,Où est mon téléphone ?,Where's my phone?,Où est mon _____?,Où est mon <b>téléphone</b>?,[sound:sapi5com-b1184911-772bef7c-63335bec-2dcf5f67-23ce3c1f.mp3]
334,café,Ce café est bien fort.,This coffee is quite strong.,Ce _____ est bien fort.,Ce <b>café</b> est bien fort.,[sound:sapi5com-f4b49545-69368d85-d70615be-6f090291-48c01bc3.mp3]
334,café,"Du café, je te prie.","Coffee, please.","Du _____, je te prie.","Du <b>café</b>, je te prie.",[sound:sapi5com-a2ee9551-2412a0e7-6692de34-66923411-c84c7c7f.mp3]
334,café,Il adore le café.,He loves coffee.,Il adore le _____.,Il adore le <b>café</b>.,[sound:sapi5com-827c2694-b72e430c-575eb25e-be00398d-ca7d79e1.mp3]
334,café,Je sens le café.,I smell coffee.,Je sens le _____.,Je sens le <b>café</b>.,[sound:sapi5com-00d3dfec-e0ace45a-b3380af9-628b30fb-94e5a4ff.mp3]
336,main,Il m'a pris la main.,He caught hold of my hand.,Il m'a pris la _____.,Il m'a pris la <b>main</b>.,[sound:sapi5com-323eb748-8dc74114-b8949705-7b132140-459f001d.mp3]
339,dix,Elle a dix enfants.,She has ten children.,Elle a _____ enfants.,Elle a <b>dix</b> enfants.,[sound:sapi5com-47d8882a-23ae083c-90e1ceb9-94e0ddd1-78214ac7.mp3]
339,dix,Il est presque dix heures.,It is almost ten o'clock.,Il est presque _____ heures.,Il est presque <b>dix</b> heures.,[sound:sapi5com-842c5a10-a866c3b5-c4a2e171-50a0d71e-32362a39.mp3]
340,tellement,Il est tellement jeune.,He's so young.,Il est _____ jeune.,Il est <b>tellement</b> jeune.,[sound:sapi5com-87a19363-7e52f350-5c2049c5-a3259035-81fed22c.mp3]
340,tellement,Je me sens tellement perdu.,I just feel so lost.,Je me sens _____ perdu.,Je me sens <b>tellement</b> perdu.,[sound:sapi5com-c3aa7d99-0cfd3198-a7a37eaf-6c446a9f-bbb6d395.mp3]
340,tellement,Nous pouvons faire tellement plus.,We can do so much more.,Nous pouvons faire _____ plus.,Nous pouvons faire <b>tellement</b> plus.,[sound:sapi5com-cb49de74-c53d0c3e-485a79e8-8f42faf6-071cf222.mp3]
340,tellement,Tu étais tellement fort.,You were so strong.,Tu étais _____ fort.,Tu étais <b>tellement</b> fort.,[sound:sapi5com-06166298-f1baaab0-95a5b271-928c1099-237641c7.mp3]
340,tellement,Vous êtes tellement difficile !,You're so picky.,Vous êtes _____ difficile!,Vous êtes <b>tellement</b> difficile!,[sound:sapi5com-6619fbff-d3cb4f90-3059e61e-36e492ce-9a43a9e4.mp3]
342,bus,Il y a notre bus.,There's our bus.,Il y a notre _____.,Il y a notre <b>bus</b>.,[sound:sapi5com-57a276dc-89416860-fabab9b5-7bba6f11-65971b26.mp3]
342,bus,Le bus arrive.,Here comes the bus.,Le _____ arrive.,Le <b>bus</b> arrive.,[sound:sapi5com-514e8da5-1a34ac31-8daef77f-b66d5c4b-42abaa18.mp3]
342,bus,Où va ce bus ?,Where does that bus go?,Où va ce _____?,Où va ce <b>bus</b>?,[sound:sapi5com-a4ae5c64-3a9b4eed-e7a7a39f-2a84007c-0b8e97b6.mp3]
343,histoire,Je connais cette histoire.,I know that story.,Je connais cette _____.,Je connais cette <b>histoire</b>.,[sound:sapi5com-c3b34e0c-67cc49e2-e802da33-f1402bd1-368e7296.mp3]
343,histoire,Quelle est leur histoire ?,What's their story?,Quelle est leur _____?,Quelle est leur <b>histoire</b>?,[sound:sapi5com-95c1762c-9f9be772-994e761e-63f4bb7f-6c465ab6.mp3]
344,attendre,Il m'a fait attendre longtemps.,He kept me waiting for a long time.,Il m'a fait _____ longtemps.,Il m'a fait <b>attendre</b> longtemps.,[sound:sapi5com-ef48fbe7-f6522a45-04cd2c06-368bc37a-5ec8db95.mp3]
344,attendre,Il nous faut attendre.,We must wait.,Il nous faut _____.,Il nous faut <b>attendre</b>.,[sound:sapi5com-6d3de245-5aa8aa92-5eff659c-db8dffa5-288d676f.mp3]
344,attendre,Je peux attendre quelques heures.,I can wait a few hours.,Je peux _____ quelques heures.,Je peux <b>attendre</b> quelques heures.,[sound:sapi5com-a9ab600c-555686ed-9694f2e0-7843753f-d095a6a8.mp3]
344,attendre,Je sais quoi attendre.,I know what to watch for.,Je sais quoi _____.,Je sais quoi <b>attendre</b>.,[sound:sapi5com-0cd4ef7a-06162376-fabc9ebe-90859100-dd2823c5.mp3]
344,attendre,Ne me faites pas attendre !,Don't keep me waiting.,Ne me faites pas _____!,Ne me faites pas <b>attendre</b>!,[sound:sapi5com-9387c1ea-b5b60b05-26cb55b7-9053c2c2-81273416.mp3]
345,entendre,Je veux en entendre davantage.,I want to hear more.,Je veux en _____ davantage.,Je veux en <b>entendre</b> davantage.,[sound:sapi5com-b154fdf2-d0b3b629-1cb218b0-774adcc1-13ceef1f.mp3]
345,entendre,Personne ne peut nous entendre.,No one can hear us.,Personne ne peut nous _____.,Personne ne peut nous <b>entendre</b>.,[sound:sapi5com-50e80b53-ff40846a-83afff54-a25e88a2-5aeb5810.mp3]
347,famille,Je connais sa famille.,I know his family.,Je connais sa _____.,Je connais sa <b>famille</b>.,[sound:sapi5com-c367a2d9-92823a7c-8a25b0c9-0be64490-069e034a.mp3]
347,famille,Je veux une famille.,I want a family.,Je veux une _____.,Je veux une <b>famille</b>.,[sound:sapi5com-29ea1794-8e7abb20-4785cc02-03855d50-2f8627c8.mp3]
347,famille,Pensez à votre famille !,Think of your family.,Pensez à votre _____!,Pensez à votre <b>famille</b>!,[sound:sapi5com-e4761a7e-5a706383-416aab8f-4d171f79-0fd03273.mp3]
347,famille,Sa famille est très grande.,Her family is very large.,Sa _____ est très grande.,Sa <b>famille</b> est très grande.,[sound:sapi5com-e639e5e2-ca3f04c2-a6594019-985c70d6-484daf51.mp3]
347,famille,Toute ma famille va bien.,My family are all well.,Toute ma _____ va bien.,Toute ma <b>famille</b> va bien.,[sound:sapi5com-a698c394-50defc14-7db2e449-2a0e18fd-ffed16a0.mp3]
348,accord,Nous avons un accord.,We have an agreement.,Nous avons un _____.,Nous avons un <b>accord</b>.,[sound:sapi5com-81696489-6b1cb953-122e53a3-315ceb23-c16cc883.mp3]
348,accord,Un accord est un accord.,A deal is a deal.,Un _____ est un _____.,Un <b>accord</b> est un <b>accord</b>.,[sound:sapi5com-9b567c0b-4e3cdcfb-baec43c5-97c1443d-96f24538.mp3]
349,passer,Je ne fais que passer.,I just dropped in.,Je ne fais que _____.,Je ne fais que <b>passer</b>.,[sound:sapi5com-abfb5983-a6d57e77-60358c93-4de9953c-d134e229.mp3]
349,passer,Je vais passer chez toi.,I'll come to your place.,Je vais _____ chez toi.,Je vais <b>passer</b> chez toi.,[sound:sapi5com-af1c3ad8-b059244b-2505a433-956cac84-5bac655b.mp3]
349,passer,Tout semble se passer bien.,Everything appears to be going well.,Tout semble se _____ bien.,Tout semble se <b>passer</b> bien.,[sound:sapi5com-ea208d12-3dbc1fcf-241cc34f-caad9fea-9635dd33.mp3]
349,passer,Tout va bien se passer.,Anything will be fine.,Tout va bien se _____.,Tout va bien se <b>passer</b>.,[sound:sapi5com-c9213b2a-26d93d82-fa5365f0-3c3ea177-055d46fb.mp3]
350,donné,Elle me l'a donné.,She gave it to me.,Elle me l'a _____.,Elle me l'a <b>donné</b>.,[sound:sapi5com-8a4f8e08-f7cc960a-cb3b4baf-816a8ad3-804de9bd.mp3]
350,donné,Qui t'a donné ça ?,Who gave you this?,Qui t'a _____ ça?,Qui t'a <b>donné</b> ça?,[sound:sapi5com-8aef48fa-f6706f68-70ee2c5b-9f2a5db6-cc7829fc.mp3]
351,reste,Il nous reste trois jours.,We have three days left.,Il nous _____ trois jours.,Il nous <b>reste</b> trois jours.,[sound:sapi5com-51e45a9f-2d539532-dfe4ea28-774515ad-778b2378.mp3]
351,reste,Il reste avec sa famille.,He is staying with his relatives.,Il _____ avec sa famille.,Il <b>reste</b> avec sa famille.,[sound:sapi5com-784a0829-b3f0c51b-ef24e02b-8cbae4b2-20eb1325.mp3]
351,reste,Où est le reste ?,Where's the rest?,Où est le _____?,Où est le <b>reste</b>?,[sound:sapi5com-eadd915c-77c7e64b-ea155cbe-effaa250-0767dcd0.mp3]
351,reste,Que cela reste entre nous!,That should be kept between us.,Que cela _____ entre nous!,Que cela <b>reste</b> entre nous!,[sound:sapi5com-c2968111-bc16fd2d-f41e107d-04dc6632-46389f01.mp3]
351,reste,Reste dans ta chambre.,Stay in your room.,_____ dans ta chambre.,<b>Reste</b> dans ta chambre.,[sound:sapi5com-92966801-3b0184b8-6e851184-90c3d09c-e813cbf7.mp3]
355,partie,Cette partie est tellement difficile.,This game is so hard.,Cette _____ est tellement difficile.,Cette <b>partie</b> est tellement difficile.,[sound:sapi5com-136f8220-e94ecae0-30c9ec25-3232bcfa-8371be0c.mp3]
355,partie,Je suis partie.,I left.,Je suis _____.,Je suis <b>partie</b>.,[sound:sapi5com-4d070fc2-e04a5fdd-03691ab5-c4bff6f2-962e623d.mp3]
355,partie,Nous avons perdu la partie.,We lost the game.,Nous avons perdu la _____.,Nous avons perdu la <b>partie</b>.,[sound:sapi5com-cdb98f97-0126afed-df6a04a6-e8414a5c-cd122705.mp3]
355,partie,Tu en fais partie.,You're part of this.,Tu en fais _____.,Tu en fais <b>partie</b>.,[sound:sapi5com-9ae9cb81-cfa58c99-5e22004b-83041a59-26a10584.mp3]
355,partie,Vous faites partie du problème.,You're part of the problem.,Vous faites _____ du problème.,Vous faites <b>partie</b> du problème.,[sound:sapi5com-6cc97abe-ead3b4f3-f75af069-f174abb2-78d54a66.mp3]
361,occupé,Il sera occupé demain.,He will be busy tomorrow.,Il sera _____ demain.,Il sera <b>occupé</b> demain.,[sound:sapi5com-bf9e31a0-a95e019d-26364e88-a85dc1b1-e44b3ecd.mp3]
361,occupé,Je suis vraiment très occupé.,I really am very busy.,Je suis vraiment très _____.,Je suis vraiment très <b>occupé</b>.,[sound:sapi5com-1afab093-418e7fba-9bf2f376-2e1a439e-5541659c.mp3]
361,occupé,Mon père était occupé.,My father was busy.,Mon père était _____.,Mon père était <b>occupé</b>.,[sound:sapi5com-3d67b1b6-9055a006-8598ac9c-5aaef6df-416d2f00.mp3]
361,occupé,Tu es fort occupé.,You're very busy.,Tu es fort _____.,Tu es fort <b>occupé</b>.,[sound:sapi5com-4bd12fb7-dbb9a7b1-19354b19-37e1dd03-68690e20.mp3]
361,occupé,"Vous avez été occupé, non ?","You've been busy, haven't you?","Vous avez été _____, non?","Vous avez été <b>occupé</b>, non?",[sound:sapi5com-b055c3e6-02554e15-65be099e-f7ecf60d-355c54b6.mp3]
362,année,Je me marie cette année.,I'm getting married this year.,Je me marie cette _____.,Je me marie cette <b>année</b>.,[sound:sapi5com-a4b423f4-029e18db-1f04d80b-28722905-8fa898a9.mp3]
363,apprendre,Je devrais apprendre le français.,I should learn French.,Je devrais _____ le français.,Je devrais <b>apprendre</b> le français.,[sound:sapi5com-9935b468-0ac364f5-64f0bfde-5a00b166-069df9cf.mp3]
364,fils,Il a trois fils.,He has three children.,Il a trois _____.,Il a trois <b>fils</b>.,[sound:sapi5com-0ed308eb-4f9f532c-d089a36b-0909833f-4fc706e3.mp3]
364,fils,Il avait trois fils.,He had three sons.,Il avait trois _____.,Il avait trois <b>fils</b>.,[sound:sapi5com-31e7cfdb-f5c520bd-b7260cd3-e929a436-1f321e2c.mp3]
364,fils,Je connais ton fils.,I know your son.,Je connais ton _____.,Je connais ton <b>fils</b>.,[sound:sapi5com-e8c9b2a1-0f07a169-ea054c27-9515151e-9ef9f177.mp3]
364,fils,Nous sommes ses fils.,We are his sons.,Nous sommes ses _____.,Nous sommes ses <b>fils</b>.,[sound:sapi5com-5eb11089-56023d81-4a38c9a5-35e8bd53-63a21355.mp3]
364,fils,Où est mon fils ?,Where is my son?,Où est mon _____?,Où est mon <b>fils</b>?,[sound:sapi5com-a6e12ee2-341295c8-3b29a5c4-c960eaea-2ce59237.mp3]
366,alors,"Alors, quel est votre problème ?",Then what's your problem?,"_____, quel est votre problème?","<b>Alors</b>, quel est votre problème?",[sound:sapi5com-cee820a6-a3ec5c2d-a34af4b4-522c29bd-b42d6762.mp3]
366,alors,Ce sera alors trop tard.,It'll be too late then.,Ce sera _____ trop tard.,Ce sera <b>alors</b> trop tard.,[sound:sapi5com-cef723bd-143cbf04-bc30b69c-10a3b745-1d4913ef.mp3]
366,alors,"Si pas maintenant, alors quand ?","If not now, then when?","Si pas maintenant, _____ quand?","Si pas maintenant, <b>alors</b> quand?",[sound:sapi5com-cec2597c-9d2af310-83123abc-cd3c195a-4c457d0e.mp3]
367,vivre,Elle veut vivre en ville.,She wants to live in the city.,Elle veut _____ en ville.,Elle veut <b>vivre</b> en ville.,[sound:sapi5com-9707bfe7-f5576a4a-aca1131c-a69ef2e8-35f6e3d2.mp3]
367,vivre,Il ne doit pas vivre.,He must not live.,Il ne doit pas _____.,Il ne doit pas <b>vivre</b>.,[sound:sapi5com-16d472e1-0e90f525-1eb20790-19976014-a20f30b7.mp3]
