1267,mensonge,Il dit un mensonge.,He is telling a lie.,Il dit un _____.,Il dit un <b>mensonge</b>.,[sound:sapi5com-d5dc4656-0e8394e5-6328abdc-e09a5692-d5fcb8a3.mp3]
1268,vienne,Il se peut qu'elle vienne.,She might come.,Il se peut qu'elle _____.,Il se peut qu'elle <b>vienne</b>.,[sound:sapi5com-ba6a8757-4f3329fa-836e3d0c-8834d94e-f0399bbd.mp3]
1268,vienne,Vienne est une jolie ville.,Vienna is a beautiful city.,_____ est une jolie ville.,<b>Vienne</b> est une jolie ville.,[sound:sapi5com-47a5547c-feadb142-14f0acc4-5d2c8c4a-c99acedf.mp3]
1271,balle,Combien coûte cette balle ?,How much is this ball?,Combien coûte cette _____?,Combien coûte cette <b>balle</b>?,[sound:sapi5com-a1bb157e-a5473409-1affd28d-a5262d6d-c2e84aa9.mp3]
1272,printemps,Le printemps est venu.,Spring has come.,Le _____ est venu.,Le <b>printemps</b> est venu.,[sound:sapi5com-a22cb588-90c26a77-1be10460-0b62e123-ffcd9d62.mp3]
1274,cinéma,Je vais rarement au cinéma.,I rarely go to the movies.,Je vais rarement au _____.,Je vais rarement au <b>cinéma</b>.,[sound:sapi5com-9bee9f50-f86cb409-2fcf1c7a-5e72db00-38399ba6.mp3]
1276,traverser,Il va traverser la rivière.,He's going to cross the river.,Il va _____ la rivière.,Il va <b>traverser</b> la rivière.,[sound:sapi5com-846a052b-9d2d0453-ed793e5d-b41d317b-bf56b072.mp3]
1279,aura,La réunion aura lieu demain.,The meeting will take place tomorrow.,La réunion _____ lieu demain.,La réunion <b>aura</b> lieu demain.,[sound:sapi5com-b5cb1c21-c38819e8-53e81e5e-1dc2b39a-d268ce73.mp3]
1281,lors,Depuis lors nous sommes amis.,We've been friends ever since.,Depuis _____ nous sommes amis.,Depuis <b>lors</b> nous sommes amis.,[sound:sapi5com-a4848131-ef3a3989-04a4b574-1d123870-a024aebe.mp3]
1285,truc,Fais attention avec ce truc.,Be careful with that thing.,Fais attention avec ce _____.,Fais attention avec ce <b>truc</b>.,[sound:sapi5com-ac4a8d6e-26c47932-a232354f-8105e411-bff3ec21.mp3]
1285,truc,Je veux manger un truc.,I want something to eat.,Je veux manger un _____.,Je veux manger un <b>truc</b>.,[sound:sapi5com-13a1aab1-256f7443-008ba6a8-22f78086-318de1d4.mp3]
1285,truc,Où est le truc ?,Where's the catch?,Où est le _____?,Où est le <b>truc</b>?,[sound:sapi5com-e0b4f627-4105a9e1-5351754a-d5387a9c-333fa428.mp3]
1289,contact,Mettez le contact !,Turn on the ignition.,Mettez le _____!,Mettez le <b>contact</b>!,[sound:sapi5com-61f12328-fa5405b7-4b115f47-f9ca2290-c9d1a30a.mp3]
1289,contact,Restez en contact avec moi.,Keep in touch with me.,Restez en _____ avec moi.,Restez en <b>contact</b> avec moi.,[sound:sapi5com-2ff0d1c5-bad9a229-01194ea4-49bf46cd-2bde13b1.mp3]
1290,billet,Combien coûte le billet ?,How much is the ticket?,Combien coûte le _____?,Combien coûte le <b>billet</b>?,[sound:sapi5com-d0fdaf4b-93e0442b-50bfc37c-bdac261b-4540a2dc.mp3]
1290,billet,Que veut dire ce billet ?,What does this note mean?,Que veut dire ce _____?,Que veut dire ce <b>billet</b>?,[sound:sapi5com-20ff9ec2-e7abdb7d-97e0578a-5c213890-dbf634f7.mp3]
1291,sauf,Il est tout sauf honnête.,He is anything but honest.,Il est tout _____ honnête.,Il est tout <b>sauf</b> honnête.,[sound:sapi5com-66b8ccc7-b1a68598-e88094c8-6973b5b0-5affb606.mp3]
1295,droite,Prenez la route à droite.,Take the road on the right.,Prenez la route à _____.,Prenez la route à <b>droite</b>.,[sound:sapi5com-f7c989f8-99dbfff6-c574cd45-9dd2ad92-c6a41ce2.mp3]
1297,patient,Vous devez vous montrer patient.,You have to be patient.,Vous devez vous montrer _____.,Vous devez vous montrer <b>patient</b>.,[sound:sapi5com-e879989b-f90b4cb3-e9441385-091224b7-ef32d7c7.mp3]
1298,trucs,Je connais quelques trucs.,I know a few things.,Je connais quelques _____.,Je connais quelques <b>trucs</b>.,[sound:sapi5com-33655cf2-d850a6a4-b5edae8c-74d66e62-35a57e41.mp3]
1298,trucs,Que sont tous ces trucs ?,What's all this stuff?,Que sont tous ces _____?,Que sont tous ces <b>trucs</b>?,[sound:sapi5com-49f5dc48-024ff83f-1a6840e2-f5cca2c4-fe90a99a.mp3]
1304,voilà,Me voilà satisfait.,I'm contented.,Me _____ satisfait.,Me <b>voilà</b> satisfait.,[sound:sapi5com-baffafed-62878191-018fb4bc-1cf8f436-74acbe13.mp3]
35,y,Ça y est.,This is it.,Ça _____ est.,Ça <b>y</b> est.,[sound:sapi5com-eecab745-974bc9d5-9de5af6b-0d13fdb8-49cd91b4.mp3]
41,moi,Moi je veux ça.,I want that.,_____ je veux ça.,<b>Moi</b> je veux ça.,[sound:sapi5com-8d4390ba-3d2b218f-37e68063-8a4cb709-3478a551.mp3]
42,tout,Je veux tout.,I want everything.,Je veux _____.,Je veux <b>tout</b>.,[sound:sapi5com-e8e23aa8-334054e4-a88d9620-9e16d21d-3ab75f20.mp3]
42,tout,Tout est à moi.,It's all mine.,_____ est à moi.,<b>Tout</b> est à moi.,[sound:sapi5com-9d792071-2daf1105-88ad7f90-e9f7245e-d3f51e0d.mp3]
43,te,Je te veux !,I want you.,Je _____ veux!,Je <b>te</b> veux!,[sound:sapi5com-d4088c71-0d09e59e-75af4236-85892444-a5ecff46.mp3]
48,avec,Je veux être avec vous.,I want to be with you.,Je veux être _____ vous.,Je veux être <b>avec</b> vous.,[sound:sapi5com-274c764f-be7fd3bf-a8d6254f-6890a2b3-533b295f.mp3]
50,fait,Il me l'a fait faire.,He made me do it.,Il me l'a _____ faire.,Il me l'a <b>fait</b> faire.,[sound:sapi5com-f228017f-3ec89bf7-ac7b787a-508e1c13-54635079.mp3]
50,fait,Qui a fait ça ?,Who did this?,Qui a _____ ça?,Qui a <b>fait</b> ça?,[sound:sapi5com-70a94d4a-2b2dbce9-9af60aa5-18084b85-c0160de2.mp3]
55,as,Tu as fait ça.,You did that.,Tu _____ fait ça.,Tu <b>as</b> fait ça.,[sound:sapi5com-fa23f156-2726a17a-2c90a191-2e35fd32-9ddb79e6.mp3]
55,as,Tu as tout.,You have everything.,Tu _____ tout.,Tu <b>as</b> tout.,[sound:sapi5com-7bde2139-4772fe8b-b60a8e62-5d638d0a-78244e1a.mp3]
59,ils,Ils sont avec moi.,They're with me.,_____ sont avec moi.,<b>Ils</b> sont avec moi.,[sound:sapi5com-3e1b9a01-9c359b82-21a3dff0-ca7b8d92-1335d9af.mp3]
63,lui,Elle est tout pour lui.,She is everything to him.,Elle est tout pour _____.,Elle est tout pour <b>lui</b>.,[sound:sapi5com-d3e6af6e-ddec198c-3525c942-166b2070-23f31492.mp3]
69,temps,Il est temps !,It's time.,Il est _____!,Il est <b>temps</b>!,[sound:sapi5com-647055c2-8fff33ac-62cf3c7e-4fd77863-fef6752d.mp3]
69,temps,Je veux du temps.,I want time.,Je veux du _____.,Je veux du <b>temps</b>.,[sound:sapi5com-1edac3de-5009a5ea-43f29975-5e8ef493-e27f12b8.mp3]
69,temps,Tout est dans les temps.,Everything is on schedule.,Tout est dans les _____.,Tout est dans les <b>temps</b>.,[sound:sapi5com-e9264800-f0040ae6-21f024c1-4207647b-196d7e1b.mp3]
71,dit,Elle m'a tout dit.,She told me everything.,Elle m'a tout _____.,Elle m'a tout <b>dit</b>.,[sound:sapi5com-92d44a74-d33966eb-30df7e7e-861b4d47-2b95b6d5.mp3]
71,dit,Il ne l'a pas dit.,He did not say so.,Il ne l'a pas _____.,Il ne l'a pas <b>dit</b>.,[sound:sapi5com-ba93ad0f-3884def6-73359bb9-0f40a07d-12fcc52a.mp3]
71,dit,Qui vous l'a dit ?,Who told you?,Qui vous l'a _____?,Qui vous l'a <b>dit</b>?,[sound:sapi5com-93a3ccff-a660844e-da1839c7-053682b9-d383b1cb.mp3]
73,cela,Tu ne veux pas cela.,You don't want this.,Tu ne veux pas _____.,Tu ne veux pas <b>cela</b>.,[sound:sapi5com-c6857016-f83fe648-f2bdd463-d40ac42e-c46d99aa.mp3]
73,cela,Vous avez fait cela.,You did that.,Vous avez fait _____.,Vous avez fait <b>cela</b>.,[sound:sapi5com-29c3c3fe-74a50272-31af9c85-167be513-b929747f.mp3]
75,ici,Je ne suis pas ici.,I'm not here.,Je ne suis pas _____.,Je ne suis pas <b>ici</b>.,[sound:sapi5com-328ee744-39fa0df8-298c270f-8be9bba0-6d076e38.mp3]
75,ici,Qui est ici avec vous ?,Who's here with you?,Qui est _____ avec vous?,Qui est <b>ici</b> avec vous?,[sound:sapi5com-100900c7-ba57fff3-fb10ecaf-ff0258ac-d55d814c.mp3]
79,comment,Comment est le temps ?,How is the weather?,_____ est le temps?,<b>Comment</b> est le temps?,[sound:sapi5com-620dd306-8ee8df04-eb414391-a0d29a5a-203f1c2e.mp3]
81,toi,Il est tout à toi.,It's all yours.,Il est tout à _____.,Il est tout à <b>toi</b>.,[sound:sapi5com-10b676f8-3f0f1d5e-1ce8e71e-3bb7fe71-262e53de.mp3]
81,toi,Je sais tout de toi.,I know all about you.,Je sais tout de _____.,Je sais tout de <b>toi</b>.,[sound:sapi5com-d01f039a-491d4730-1045487d-ff95110e-93843874.mp3]
81,toi,Qui est ici avec toi ?,Who's here with you?,Qui est ici avec _____?,Qui est ici avec <b>toi</b>?,[sound:sapi5com-9600fe38-5a6ab2b4-d250ba2e-c40d94f7-16083b9a.mp3]
82,vraiment,Je ne sais pas vraiment.,I don't know for certain.,Je ne sais pas _____.,Je ne sais pas <b>vraiment</b>.,[sound:sapi5com-ac94c8e4-b37e0ee5-93a45c2d-02cf0ca9-431cb976.mp3]
87,quelque,Elle lui dit quelque chose.,She said something to him.,Elle lui dit _____ chose.,Elle lui dit <b>quelque</b> chose.,[sound:sapi5com-895096f8-77c8e8e9-26cf55f8-05380813-c814d50d.mp3]
87,quelque,Tu es vraiment quelque chose.,You really are something.,Tu es vraiment _____ chose.,Tu es vraiment <b>quelque</b> chose.,[sound:sapi5com-01bc591f-317d0263-8bbe1b53-26d96b14-23c11a27.mp3]
88,dire,Je ne peux le dire.,I can't say.,Je ne peux le _____.,Je ne peux le <b>dire</b>.,[sound:sapi5com-f9f0df68-c2955b1e-b1b593a0-aba73ff1-69a613d2.mp3]
88,dire,Je veux te le dire.,I want to tell you.,Je veux te le _____.,Je veux te le <b>dire</b>.,[sound:sapi5com-9b7a7104-a02ec87c-121afb90-5ec6282c-4ee340dd.mp3]
88,dire,Tu peux tout me dire.,You can tell me anything.,Tu peux tout me _____.,Tu peux tout me <b>dire</b>.,[sound:sapi5com-8ed4fce6-1f890b03-d5280546-235f9ee7-13b522fa.mp3]
88,dire,Tu veux dire nous ?,Do you mean us?,Tu veux _____ nous?,Tu veux <b>dire</b> nous?,[sound:sapi5com-76d5ce72-12f3ace0-310588ac-97cc0872-40cfdf5b.mp3]
89,elles,Elles sont à moi.,They're mine.,_____ sont à moi.,<b>Elles</b> sont à moi.,[sound:sapi5com-c9af9442-a1f1285e-5fd8daf5-f227aa60-44c33859.mp3]
89,elles,Pourquoi elles ont fait ça ?,Why did they do that?,Pourquoi _____ ont fait ça?,Pourquoi <b>elles</b> ont fait ça?,[sound:sapi5com-ba7edcb3-fa3937d0-af53b583-8b6c962e-b4883173.mp3]
90,tous,Ils sont tous ici.,They're all here.,Ils sont _____ ici.,Ils sont <b>tous</b> ici.,[sound:sapi5com-03288eff-ab1cd841-298ce055-8392e0d5-a5bdb403.mp3]
90,tous,Je les ai tous.,I've got them all.,Je les ai _____.,Je les ai <b>tous</b>.,[sound:sapi5com-dcf4153b-51b2ced8-f304280b-f789be2a-ae4f8d59.mp3]
90,tous,Nous y avons tous été.,We've all been there.,Nous y avons _____ été.,Nous y avons <b>tous</b> été.,[sound:sapi5com-ce66e62e-33e66945-ba77c5d3-efc693c9-5d28d760.mp3]
90,tous,Vous êtes tous à moi.,You're all mine.,Vous êtes _____ à moi.,Vous êtes <b>tous</b> à moi.,[sound:sapi5com-41e1dab8-08f68872-656fdc93-c7a07507-2b56a5d0.mp3]
91,bien,Ça a été très bien.,That was very good.,Ça a été très _____.,Ça a été très <b>bien</b>.,[sound:sapi5com-68f6abc4-4595a1ee-8b922dae-2cc5443b-a26b4e91.mp3]
91,bien,Ça fait du bien.,It feels good.,Ça fait du _____.,Ça fait du <b>bien</b>.,[sound:sapi5com-ca5885d1-866cd2ed-99aff430-11cac9e4-a0aab1b8.mp3]
91,bien,Il est bien temps !,It's about time.,Il est _____ temps!,Il est <b>bien</b> temps!,[sound:sapi5com-4ca7185f-fc426345-2d6c42c8-002f57c5-e433cba9.mp3]
91,bien,Je le sais bien.,I do know that.,Je le sais _____.,Je le sais <b>bien</b>.,[sound:sapi5com-e3acc53b-330289d7-fe1cbd1e-a7b4cd55-70fd997b.mp3]
91,bien,Je veux le faire bien.,I want to make it right.,Je veux le faire _____.,Je veux le faire <b>bien</b>.,[sound:sapi5com-52741c0e-929d1d3a-f1d1d893-cef2f758-ee4d8d3c.mp3]
93,on,On ne dit plus ça.,We don't say that anymore.,_____ ne dit plus ça.,<b>On</b> ne dit plus ça.,[sound:sapi5com-cb9a00bd-7f0640a2-28fd97bc-1fa76cbd-e24a40ee.mp3]
93,on,On y est.,Here we are.,_____ y est.,<b>On</b> y est.,[sound:sapi5com-69b24214-d9575915-6009e5f2-46ac2f53-8dab7a1d.mp3]
94,aller,Elle m'a dit où aller.,She told me where to go.,Elle m'a dit où _____.,Elle m'a dit où <b>aller</b>.,[sound:sapi5com-1ed36d60-6ccf727c-e2d3117a-32f0bb1a-4651765a.mp3]
94,aller,Tu peux y aller.,You may go.,Tu peux y _____.,Tu peux y <b>aller</b>.,[sound:sapi5com-0f288803-a98845a6-f7cb0018-27d2badd-0d727960.mp3]
95,avoir,Je pense avoir bien fait.,I think I've done well.,Je pense _____ bien fait.,Je pense <b>avoir</b> bien fait.,[sound:sapi5com-ce8563e5-af484b92-9e4e06ad-257584cd-bae6e041.mp3]
96,besoin,Elles ont besoin de lui.,They need him.,Elles ont _____ de lui.,Elles ont <b>besoin</b> de lui.,[sound:sapi5com-b7197f45-78223773-8f4b134e-9f218673-3fee87a6.mp3]
96,besoin,Nous en avons besoin.,We need it.,Nous en avons _____.,Nous en avons <b>besoin</b>.,[sound:sapi5com-48243c29-851c7e37-026d0cfc-3f4b7792-66141941.mp3]
96,besoin,On a besoin de toi.,We need you.,On a _____ de toi.,On a <b>besoin</b> de toi.,[sound:sapi5com-709d73a1-3df182f6-38a0d4e1-7b783de6-0b35add9.mp3]
98,beaucoup,Je pense beaucoup à elle.,I think about her a lot.,Je pense _____ à elle.,Je pense <b>beaucoup</b> à elle.,[sound:sapi5com-f758c71a-9df5ae87-b48e084c-a9d100e7-6815c060.mp3]
98,beaucoup,Je veux beaucoup plus.,I want much more.,Je veux _____ plus.,Je veux <b>beaucoup</b> plus.,[sound:sapi5com-54c26feb-448a9521-9f090cd2-4e1e6dc9-acddc649.mp3]
98,beaucoup,Nous avons beaucoup de temps.,We've got plenty of time.,Nous avons _____ de temps.,Nous avons <b>beaucoup</b> de temps.,[sound:sapi5com-0f364801-3e7316db-3cd5d33c-25ac0376-9280e08b.mp3]
99,là,Elles sont là pour moi.,They're here for me.,Elles sont _____ pour moi.,Elles sont <b>là</b> pour moi.,[sound:sapi5com-028349d7-cf8140da-3a525be3-6d0df375-231ed502.mp3]
99,là,Je ne suis pas là.,I'm not here.,Je ne suis pas _____.,Je ne suis pas <b>là</b>.,[sound:sapi5com-374bbc33-619f2b5d-3d5e82b5-63297dc2-d2ea6e9f.mp3]
99,là,Tout est là.,It's all there.,Tout est _____.,Tout est <b>là</b>.,[sound:sapi5com-c1820e53-48252101-90ac4cd2-f07f7285-b36394c4.mp3]
99,là,Vous êtes là ?,Are you there?,Vous êtes _____?,Vous êtes <b>là</b>?,[sound:sapi5com-7a9c7dcf-be6afd74-01b4b854-01a3b591-ef828e42.mp3]
104,personne,Personne ne fait ça.,Nobody does that.,_____ ne fait ça.,<b>Personne</b> ne fait ça.,[sound:sapi5com-67e6b4d0-9a7d55de-dd5af759-8fc97158-e6f2850a.mp3]
104,personne,Personne ne peut le dire.,No one can say.,_____ ne peut le dire.,<b>Personne</b> ne peut le dire.,[sound:sapi5com-53c46deb-21936a3f-f572609a-642c91bc-a0b843f2.mp3]
105,parler,Il aime parler de lui.,He likes to talk about himself.,Il aime _____ de lui.,Il aime <b>parler</b> de lui.,[sound:sapi5com-6e07f41a-f0c5dd43-a7eb78b4-1603cebc-d092414e.mp3]
105,parler,Je veux parler avec elle.,I want to talk to her.,Je veux _____ avec elle.,Je veux <b>parler</b> avec elle.,[sound:sapi5com-28f3e0df-c61ca64d-0c074183-bbb80a68-c103c8af.mp3]
105,parler,Je veux parler.,I want to speak.,Je veux _____.,Je veux <b>parler</b>.,[sound:sapi5com-6ce86779-e55777fe-471213ca-b685a94a-aa2d27cb.mp3]
106,peu,Je peux parler un peu.,I can talk for a bit.,Je peux parler un _____.,Je peux parler un <b>peu</b>.,[sound:sapi5com-cf37e68c-8a1bb89f-0e4e28dc-3d969ab9-75d22931.mp3]
107,trop,Il y en a trop.,There are too many of them.,Il y en a _____.,Il y en a <b>trop</b>.,[sound:sapi5com-3b87545e-e26c009b-01188fa1-0c0c4b19-798c3aeb.mp3]
107,trop,Je ne sais pas trop.,I do not know exactly.,Je ne sais pas _____.,Je ne sais pas <b>trop</b>.,[sound:sapi5com-3752bfa5-7ba82fbb-631fcf2c-2fb6bc6e-8c2e96e6.mp3]
107,trop,Tu en sais trop.,You know too much.,Tu en sais _____.,Tu en sais <b>trop</b>.,[sound:sapi5com-1f2e15a7-bc43aebf-a1507802-83a62226-effd6938.mp3]
108,toujours,Il est toujours avec moi.,He is always with me.,Il est _____ avec moi.,Il est <b>toujours</b> avec moi.,[sound:sapi5com-edc31359-31ebcad3-83b90a19-ddb2b960-69373b3e.mp3]
108,toujours,Je veux toujours y aller.,I still want to go.,Je veux _____ y aller.,Je veux <b>toujours</b> y aller.,[sound:sapi5com-5fb63782-940a957e-a42c2fbc-a32b9f65-3b92edea.mp3]
108,toujours,Nous sommes toujours là.,We're always here.,Nous sommes _____ là.,Nous sommes <b>toujours</b> là.,[sound:sapi5com-6eeae536-8f091dc7-ca6e5ceb-d5d0d2de-879ac7bd.mp3]
109,voir,Je veux vraiment te voir.,I really want to see you.,Je veux vraiment te _____.,Je veux vraiment te <b>voir</b>.,[sound:sapi5com-b30f3fe8-f2b38dcd-4ba5060d-b2cbdef1-ca269189.mp3]
109,voir,Personne ne peut voir.,No one can see.,Personne ne peut _____.,Personne ne peut <b>voir</b>.,[sound:sapi5com-91413c57-f7ba38a0-1264df3e-bbc50b08-7529d3fb.mp3]
110,quoi,Je ne sais quoi dire.,I don't know what to say.,Je ne sais _____ dire.,Je ne sais <b>quoi</b> dire.,[sound:sapi5com-7c2e75b6-94a4bdc8-dded59c9-5bb11b55-ab2f452c.mp3]
112,deux,Nous avons besoin des deux.,We need both.,Nous avons besoin des _____.,Nous avons besoin des <b>deux</b>.,[sound:sapi5com-674078da-35fe20d5-7bacdcdf-7ae41d9c-b9d1a00c.mp3]
112,deux,Pourquoi pas les deux ?,Why not both?,Pourquoi pas les _____?,Pourquoi pas les <b>deux</b>?,[sound:sapi5com-e8fde3c5-1ffb95c0-469bd87a-1928757c-9ec25227.mp3]
112,deux,Tu peux avoir les deux.,You can have both.,Tu peux avoir les _____.,Tu peux avoir les <b>deux</b>.,[sound:sapi5com-ddac4959-ca29200a-c7db83c0-2221c219-66f3017f.mp3]
114,quand,Je vous aime quand même.,I love you anyway.,Je vous aime _____ même.,Je vous aime <b>quand</b> même.,[sound:sapi5com-3a74c074-7f27ea15-70da52da-32e05a38-be852bf5.mp3]
115,comme,Cette personne est comme moi.,That person is like me.,Cette personne est _____ moi.,Cette personne est <b>comme</b> moi.,[sound:sapi5com-2547a14d-28b830a8-51a3caa5-073c070c-ce7b9061.mp3]
115,comme,Comme tu veux.,As you like.,_____ tu veux.,<b>Comme</b> tu veux.,[sound:sapi5com-b96262c1-da39e77a-b984ccfc-cc88b5f8-db1b4132.mp3]
116,maison,À qui est cette maison ?,Whose house is this?,À qui est cette _____?,À qui est cette <b>maison</b>?,[sound:sapi5com-99e582c1-69e13c8e-29b014eb-9286eecf-c7ec164f.mp3]
116,maison,Je suis à la maison.,I'm at home.,Je suis à la _____.,Je suis à la <b>maison</b>.,[sound:sapi5com-57343787-bf12ebd1-195efdf1-30e020ab-87b8ac93.mp3]
116,maison,Je veux voir votre maison.,I want to see your house.,Je veux voir votre _____.,Je veux voir votre <b>maison</b>.,[sound:sapi5com-c72bf7a5-10f4d929-e25101bb-b7b89f1e-268d021f.mp3]
117,rien,Ça ne me dit rien.,It doesn't ring a bell.,Ça ne me dit _____.,Ça ne me dit <b>rien</b>.,[sound:sapi5com-4ed5b376-7443572a-cf801e5c-938f1a04-54e07673.mp3]
117,rien,Personne ne m'a rien dit.,No one told me anything.,Personne ne m'a _____ dit.,Personne ne m'a <b>rien</b> dit.,[sound:sapi5com-5199545c-f6328fa9-c6ee9fa1-27c949d5-bce342d3.mp3]
118,argent,Je veux mon argent.,I want my money.,Je veux mon _____.,Je veux mon <b>argent</b>.,[sound:sapi5com-2451445c-c36206e9-62676a07-3024e004-c2255f17.mp3]
118,argent,Où est votre argent ?,Where is your money?,Où est votre _____?,Où est votre <b>argent</b>?,[sound:sapi5com-b25380dd-edcb75be-79faed39-28bfc8e5-30ad2d07.mp3]
120,encore,Je ne sais encore rien.,I don't know anything yet.,Je ne sais _____ rien.,Je ne sais <b>encore</b> rien.,[sound:sapi5com-f2e6aa0a-b2bbeeae-dbb86484-313eb15e-5c796562.mp3]
120,encore,Je vous aime encore.,I still love you.,Je vous aime _____.,Je vous aime <b>encore</b>.,[sound:sapi5com-7ba2b6f5-45a7df94-c356dd72-c86a041c-42f257b7.mp3]
120,encore,Nous sommes encore ici.,We're still here.,Nous sommes _____ ici.,Nous sommes <b>encore</b> ici.,[sound:sapi5com-469da318-ca0c56e6-87855a7d-c123c4c2-90f796aa.mp3]
123,ta,Je veux voir ta maison.,I want to see your house.,Je veux voir _____ maison.,Je veux voir <b>ta</b> maison.,[sound:sapi5com-361cc1e7-b5bfb7cf-a84001ba-c43e74c9-1c29df45.mp3]
123,ta,Ma maison est ta maison.,My home is your home.,Ma maison est _____ maison.,Ma maison est <b>ta</b> maison.,[sound:sapi5com-87e6efb1-09d350b2-8ea362ae-56cd4853-97755f70.mp3]
123,ta,Qui t'a dit tout cela ?,Who told you all that?,Qui t'a dit tout cela?,Qui t'a dit tout cela?,[sound:sapi5com-d14a7c67-32679d42-7388b1f2-770ffefa-8da091d7.mp3]
125,combien,Elle a besoin de combien ?,How much does she need?,Elle a besoin de _____?,Elle a besoin de <b>combien</b>?,[sound:sapi5com-ac2ef941-57aff867-8434b49e-32b9c21f-92534d45.mp3]
127,monde,Je veux voir le monde.,I want to see the world.,Je veux voir le _____.,Je veux voir le <b>monde</b>.,[sound:sapi5com-91c8c3d1-751ade71-b9c83652-baaad2da-b0edc280.mp3]
127,monde,Où est tout le monde ?,Where is everybody?,Où est tout le _____?,Où est tout le <b>monde</b>?,[sound:sapi5com-88591755-5f30a7b6-d66c68de-cc11d70f-e698f76c.mp3]
127,monde,Tout le monde était là.,Everyone was there.,Tout le _____ était là.,Tout le <b>monde</b> était là.,[sound:sapi5com-53a9bc21-c223d71c-f3077f9a-470d192e-f16c9ef1.mp3]
127,monde,Tout le monde fait ça.,Everybody does that.,Tout le _____ fait ça.,Tout le <b>monde</b> fait ça.,[sound:sapi5com-f81b98c3-5575def5-e45ec1aa-9f03a341-35c40cb4.mp3]
127,monde,Tout le monde le dit.,Everyone's saying it.,Tout le _____ le dit.,Tout le <b>monde</b> le dit.,[sound:sapi5com-9c484726-a89e24c3-3954af52-44dc2ae2-47ff4047.mp3]
128,va,Comment va tout le monde ?,How's everyone doing?,Comment _____ tout le monde?,Comment <b>va</b> tout le monde?,[sound:sapi5com-476fabaf-23beedd1-e15f2045-26880bf3-f2f09f92.mp3]
128,va,On va y aller.,We're going to go.,On _____ y aller.,On <b>va</b> y aller.,[sound:sapi5com-021c33dc-fb633aa3-f4d43110-f51e0d5b-e51dea79.mp3]
128,va,Personne ne va faire ça.,No one's going to do that.,Personne ne _____ faire ça.,Personne ne <b>va</b> faire ça.,[sound:sapi5com-1fef853b-7537115e-e6ec19d6-dbbc0119-70d8e58c.mp3]
128,va,Qui va là ?,Who goes there?,Qui _____ là?,Qui <b>va</b> là?,[sound:sapi5com-a27dc2f7-7725f51f-5c1107c5-a25ed0c6-f0f6ee5d.mp3]
128,va,Tout le monde va bien.,Everybody is fine.,Tout le monde _____ bien.,Tout le monde <b>va</b> bien.,[sound:sapi5com-8600d55b-e1facf4d-79a05485-44f5db0e-1a97a545.mp3]
130,voiture,Il nous faut une voiture.,We need a car.,Il nous faut une _____.,Il nous faut une <b>voiture</b>.,[sound:sapi5com-a46d49ed-d60f2942-01ff3edd-f7c06042-30d734ab.mp3]
130,voiture,Je suis cette voiture.,I am following that car.,Je suis cette _____.,Je suis cette <b>voiture</b>.,[sound:sapi5com-1941e033-2684e4cf-6eecfb97-a9117869-57642c6c.mp3]
131,bon,À quoi bon faire cela ?,What's the point in doing that?,À quoi _____ faire cela?,À quoi <b>bon</b> faire cela?,[sound:sapi5com-e8ba6465-3a15dc21-d2a36e48-0c870c20-a4c00c58.mp3]
131,bon,Je suis bon.,I am good.,Je suis _____.,Je suis <b>bon</b>.,[sound:sapi5com-6a01a7f2-a8f16199-9941fe25-8f67bbd0-4968e6a9.mp3]
131,bon,Tout était très bon.,Everything was very good.,Tout était très _____.,Tout était très <b>bon</b>.,[sound:sapi5com-65db9479-50546bdf-aab1bb6b-3881fee5-d38aba98.mp3]
131,bon,Tu es vraiment bon.,You really are good.,Tu es vraiment _____.,Tu es vraiment <b>bon</b>.,[sound:sapi5com-e90a5e70-e7db06f5-c3a3e9d6-83afb134-5567741e.mp3]
131,bon,Vous êtes bon.,You are good.,Vous êtes _____.,Vous êtes <b>bon</b>.,[sound:sapi5com-b2c8c06a-8ebf5dd1-62d0899f-9a4c2ddd-c4a37e27.mp3]
132,fois,Encore une fois.,Once again.,Encore une _____.,Encore une <b>fois</b>.,[sound:sapi5com-6731194d-9db146e4-aa79a42f-270714a4-4ea01c44.mp3]
135,aussi,Je le pense aussi.,"I think so, too.",Je le pense _____.,Je le pense <b>aussi</b>.,[sound:sapi5com-c53a03cf-e5bd5ef3-3182ec96-67b92864-dc0d389a.mp3]
135,aussi,Je vous aime aussi.,"I love you, too.",Je vous aime _____.,Je vous aime <b>aussi</b>.,[sound:sapi5com-3a335dce-b617bfda-0300ee58-9848497a-e10ed4f2.mp3]
135,aussi,Nous aussi nous sommes là.,"We're here, too.",Nous _____ nous sommes là.,Nous <b>aussi</b> nous sommes là.,[sound:sapi5com-91d307e1-0189f84a-36fb7134-c35712a0-c20cd777.mp3]
135,aussi,"Tu peux le faire, aussi.","You can do it, too.","Tu peux le faire, _____.","Tu peux le faire, <b>aussi</b>.",[sound:sapi5com-bc40a331-aa2192f0-ca6f274e-09d84600-facd5feb.mp3]
135,aussi,Tu y étais aussi.,"You were there, too.",Tu y étais _____.,Tu y étais <b>aussi</b>.,[sound:sapi5com-5aeccf07-38eabe46-bd8e7bb3-6557cfc6-49ce0d65.mp3]
136,vu,Elle ne l'a jamais vu.,She has never seen him.,Elle ne l'a jamais _____.,Elle ne l'a jamais <b>vu</b>.,[sound:sapi5com-7d2fc513-f3a345ce-efb57755-4373fc9a-5ef74ba2.mp3]
136,vu,Je vous y ai vu.,I saw you there.,Je vous y ai _____.,Je vous y ai <b>vu</b>.,[sound:sapi5com-4152bff1-a36829af-32420714-c70d3ef7-ef57e878.mp3]
136,vu,Nous avons vu quelque chose.,We saw something.,Nous avons _____ quelque chose.,Nous avons <b>vu</b> quelque chose.,[sound:sapi5com-b62909bb-78885c9e-3d1eb339-fafe8dc9-25fd409e.mp3]
136,vu,Tout le monde l'a vu.,Everyone saw it.,Tout le monde l'a _____.,Tout le monde l'a <b>vu</b>.,[sound:sapi5com-cfc4444b-5c8e41ce-1b336310-5f2d1581-beed5a0d.mp3]
138,ceci,Ceci est pour toi.,This is for you.,_____ est pour toi.,<b>Ceci</b> est pour toi.,[sound:sapi5com-e130065f-a333f7cf-8a83651e-9c802a3e-fbb07600.mp3]
138,ceci,Ceci et rien de plus.,This and no more.,_____ et rien de plus.,<b>Ceci</b> et rien de plus.,[sound:sapi5com-c48010d3-131c1cec-e35398c4-ceff38ee-ec9f54a8.mp3]
138,ceci,Je veux voir ceci.,I want to see this.,Je veux voir _____.,Je veux voir <b>ceci</b>.,[sound:sapi5com-e4f3aec9-99da7b3d-139c80cb-a4b011bb-e213456b.mp3]
138,ceci,Tu peux faire ceci.,You can do this.,Tu peux faire _____.,Tu peux faire <b>ceci</b>.,[sound:sapi5com-aedccde2-922451ba-ada39a4c-077a80df-fd6a6ec1.mp3]
138,ceci,Vous avez fait ceci.,You did this.,Vous avez fait _____.,Vous avez fait <b>ceci</b>.,[sound:sapi5com-f6450ca8-68120718-326dac7a-d83a041c-69d839f6.mp3]
140,hier,Elle était là hier.,It was there yesterday.,Elle était là _____.,Elle était là <b>hier</b>.,[sound:sapi5com-31f4f9bf-a7a3fe9f-7af3167e-f46397a2-0894d8d6.mp3]
140,hier,Je vous ai vu hier.,I saw you yesterday.,Je vous ai vu _____.,Je vous ai vu <b>hier</b>.,[sound:sapi5com-3a8fb2f0-737c9e20-bec3d305-f06fda2b-8b03147f.mp3]
140,hier,Nous avons fait ça hier.,We did that yesterday.,Nous avons fait ça _____.,Nous avons fait ça <b>hier</b>.,[sound:sapi5com-26d133a8-8c3418d5-6d25bf4b-3a2d4b02-a2212365.mp3]
141,travail,Comment va le travail ?,How's work?,Comment va le _____?,Comment va le <b>travail</b>?,[sound:sapi5com-6a8c803f-f3f1d653-f93e6c3d-801970cd-3a702929.mp3]
